,0
186,It is not unheard-of for the agency responsible for the construction to simply choose the proposal that asks for the least funding.
187,"CRM archaeologists face considerable time pressure, often being forced to complete their work in a fraction of the time that might be allotted for a purely scholarly endeavour."
188,Compounding the time pressure is the vetting process of site reports that are required (in the US) to be submitted by CRM firms to the appropriate State Historic Preservation Office (SHPO).
189,"From the SHPO's perspective there is to be no difference between a report submitted by a CRM firm operating under a deadline, and a multi-year academic project."
190,"The end result is that for a Cultural Resource Management archaeologist to be successful, they must be able to produce academic quality documents at a corporate world pace."
191,"The annual ratio of open academic archaeology positions (inclusive of post-doc, temporary, and non- tenure track appointments) to the annual number of archaeology MA/MSc and PhD students is disproportionate."
192,"Cultural Resource Management, once considered an intellectual backwater for individuals with ""strong backs and weak minds,"" has attracted these graduates, and CRM offices are thus increasingly staffed by advance degreed individuals with a track record of producing scholarly articles but who also have extensive CRM field experience."
193,This happens on the one hand through international agreements and on the other hand through organizations that monitor or enforce protection.
194,"United Nations, UNESCO and Blue Shield International deal with the protection of cultural heritage and thus also archaeological sites."
195,This also applies to the integration of United Nations peacekeeping.
196,"Blue Shield International has undertaken various fact-finding missions in recent years to protect archaeological sites during the wars in Libya, Syria, Egypt and Lebanon."
197,"If you destroy their culture, you also destroy their identity."
198,"Many people are uprooted, often have no prospects anymore and subsequently flee from their homeland."""
199,This general tendency laid the foundation for the modern popular view of archaeology and archaeologists.
200,Many of the public view archaeology as something only available to a narrow demographic.
201,"The job of archaeologist is depicted as a ""romantic adventurist occupation""."
202,and as a hobby more than a job in the scientific community.
203,"Cinema audiences form a notion of ""who archaeologists are, why they do what they do, and how relationships to the past are constituted"", and is often under the impression that all archaeology takes place in a distant and foreign land, only to collect monetarily or spiritually priceless artifacts."
204,The modern depiction of archaeology has incorrectly formed the public's perception of what archaeology is.
205,"Much thorough and productive research has indeed been conducted in dramatic locales such as Copán and the Valley of the Kings, but the bulk of activities and finds of modern archaeology are not so sensational."
206,"Archaeological adventure stories tend to ignore the painstaking work involved in carrying out modern surveys, excavations, and data processing."
207,"Some archaeologists refer to such off-the-mark portrayals as ""pseudoarchaeology""."
208,Archaeologists are also very much reliant on public support; the question of exactly who they are doing their work for is often discussed.
209,"They seek to stop looting by combatting people who illegally take artifacts from protected sites, and by alerting people who live near archaeological sites of the threat of looting."
210,"Common methods of public outreach include press releases, the encouragement of school field trips to sites under excavation by professional archaeologists, and making reports and publications accessible outside of academia."
211,Public appreciation of the significance of archaeology and archaeological sites often leads to improved protection from encroaching development or other threats.
212,One audience for archaeologists' work is the public.
213,"They increasingly realize that their work can benefit non-academic and non-archaeological audiences, and that they have a responsibility to educate and inform the public about archaeology."
214,"Local heritage awareness is aimed at increasing civic and individual pride through projects such as community excavation projects, and better public presentations of archaeological sites and knowledge."
215,"of Agriculture, Forest Service (USFS) operates a volunteer archaeology and historic preservation program called the Passport in Time (PIT)."
216,"The Mardi Gras Shipwreck Project integrated a one-hour HD documentary, short videos for public viewing and video updates during the expedition as part of the educational outreach."
217,Webcasting is also another tool for educational outreach.
218,"For one week in 2000 and 2001, live underwater video of the Queen Anne's Revenge Shipwreck Project was webcast to the Internet as a part of the QAR DiveLive educational program that reached thousands of children around the world."
219,"Where possible, archaeologists now make more provisions for public involvement and outreach in larger projects than they once did, and many local archaeological organizations operate within the Community archaeology framework to expand public involvement in smaller-scale, more local projects."
220,"Archaeological excavation, however, is best undertaken by well-trained staff that can work quickly and accurately."
221,Often this requires observing the necessary health and safety and indemnity insurance issues involved in working on a modern building site with tight deadlines.
222,Certain charities and local government bodies sometimes offer places on research projects either as part of academic work or as a defined community project.
223,"Often archaeologists are assisted by the public in the locating of archaeological sites, which professional archaeologists have neither the funding, nor the time to do."
225,"ALI founded a website, The Archaeology Channel to support the organization's mission ""to nurturing and bringing attention to the human cultural heritage, by using media in the most efficient and effective ways possible."""
226,"It includes much fictional archaeological work (discussed above), as well as some actual activity."
227,"Many non-fiction authors have ignored the scientific methods of processual archaeology, or the specific critiques of it contained in post-processualism."
229,"His 1968 book, Chariots of the Gods?, together with many subsequent lesser-known works, expounds a theory of ancient contacts between human civilization on Earth and more technologically advanced extraterrestrial civilizations."
230,"This theory, known as palaeocontact theory, or Ancient astronaut theory, is not exclusively Däniken's, nor did the idea originate with him."
231,"Works of this nature are usually marked by the renunciation of well-established theories on the basis of limited evidence, and the interpretation of evidence with a preconceived theory in mind."
232,"For instance, many of the tombs of the Egyptian pharaohs were looted during antiquity."
233,"Archaeology stimulates interest in ancient objects, and people in search of artifacts or treasure cause damage to archaeological sites."
234,The commercial and academic demand for artifacts unfortunately contributes directly to the illicit antiquities trade.
235,Smuggling of antiquities abroad to private collectors has caused great cultural and economic damage in many countries whose governments lack the resources and or the will to deter it.
236,"Looters damage and destroy archaeological sites, denying future generations information about their ethnic and cultural heritage."
237,"For years, American archaeologists dug on Indian burial grounds and other places considered sacred, removing artifacts and human remains to storage facilities for further study."
238,In some cases human remains were not even thoroughly studied but instead archived rather than reburied.
239,"Furthermore, Western archaeologists' views of the past often differ from those of tribal peoples."
240,"The West views time as linear; for many natives, it is cyclic."
241,"From a Western perspective, the past is long-gone; from a native perspective, disturbing the past can have dire consequences in the present."
242,"As a consequence of this, American Indians attempted to prevent archaeological excavation of sites inhabited by their ancestors, while American archaeologists believed that the advancement of scientific knowledge was a valid reason to continue their studies."
243,"This contradictory situation was addressed by the Native American Graves Protection and Repatriation Act (NAGPRA, 1990), which sought to reach a compromise by limiting the right of research institutions to possess human remains."
244,"Due in part to the spirit of postprocessualism, some archaeologists have begun to actively enlist the assistance of indigenous peoples likely to be descended from those under study."
245,Archaeologists have also been obliged to re-examine what constitutes an archaeological site in view of what native peoples believe to constitute sacred space.
246,"To many native peoples, natural features such as lakes, mountains or even individual trees have cultural significance."
247,Australian archaeologists especially have explored this issue and attempted to survey these sites to give them some protection from being developed.
248,Such work requires close links and trust between archaeologists and the people they are trying to help and at the same time study.
249,"While this cooperation presents a new set of challenges and hurdles to fieldwork, it has benefits for all parties involved."
250,"Tribal elders cooperating with archaeologists can prevent the excavation of areas of sites that they consider sacred, while the archaeologists gain the elders' aid in interpreting their finds."
251,There have also been active efforts to recruit aboriginal peoples directly into the archaeological profession.
252,"An example of this occurred on 21 June 2005, when community members and elders from a number of the 10 Algonquian nations in the Ottawa area convened on the Kitigan Zibi reservation near Maniwaki, Quebec, to inter ancestral human remains and burial goods—some dating back 6,000 years."
253,"It was not determined, however, if the remains were directly related to the Algonquin people who now inhabit the region."
254,"The remains may be of Iroquoian ancestry, since Iroquoian people inhabited the area before the Algonquin."
255,"Moreover, the oldest of these remains might have no relation at all to the Algonquin or Iroquois, and belong to an earlier culture who previously inhabited the area."
256,"The remains and artifacts, including jewelry, tools and weapons, were originally excavated from various sites in the Ottawa Valley, including Morrison and the Allumette Islands."
257,"They had been part of the Canadian Museum of Civilization's research collection for decades, some since the late 19th century."
258,"Elders from various Algonquin communities conferred on an appropriate reburial, eventually deciding on traditional redcedar and birchbark boxes lined with redcedar chips, muskrat and beaver pelts."
259,An inconspicuous rock mound marks the reburial site where close to 80 boxes of various sizes are buried.
260,"Because of this reburial, no further scientific study is possible."
