,0
0,Archaeology (or archeology) is the study of human activity through the recovery and analysis of material culture.
1,"Archaeology is often considered a branch of socio-cultural anthropology, but archaeologists also draw from biological, geological, and environmental systems through their study of the past."
2,"The archaeological record consists of artifacts, architecture, biofacts or ecofacts and cultural landscapes."
3,Archaeology can be considered both a social science and a branch of the humanities.
4,"Archaeology is distinct from palaeontology, which is the study of fossil remains."
5,"It is particularly important for learning about prehistoric societies, for whom there may be no written records to study."
6,"Prehistory includes over 99% of the human past, from the Paleolithic until the advent of literacy in societies across the world."
7,"Archaeology has various goals, which range from understanding culture history to reconstructing past lifeways to documenting and explaining changes in human societies through time."
8,"In broad scope, archaeology relies on cross-disciplinary research."
9,"Archaeology developed out of antiquarianism in Europe during the 19th century, and has since become a discipline practiced across the world."
10,Archaeology has been used by nation-states to create particular visions of the past.
11,"Since its early development, various specific sub-disciplines of archaeology have developed, including maritime archaeology, feminist archaeology and archaeoastronomy, and numerous different scientific techniques have been developed to aid archaeological investigation."
12,"Nonetheless, today, archaeologists face many problems, such as dealing with pseudoarchaeology, the looting of artifacts, a lack of public interest, and opposition to the excavation of human remains."
13,"Not only did he lead the first excavations which were to find the foundation deposits of the temples of Šamaš the sun god, the warrior goddess Anunitu (both located in Sippar), and the sanctuary that Naram-Sin built to the moon god, located in Harran, but he also had them restored to their former glory."
14,He was also the first to date an archaeological artifact in his attempt to date Naram-Sin's temple during his search for it.
15,"Even though his estimate was inaccurate by about 1,500 years, it was still a very good one considering the lack of accurate dating technology at the time."
16,"Antiquarians studied history with particular attention to ancient artifacts and manuscripts, as well as historical sites."
17,"Antiquarianism focused on the empirical evidence that existed for the understanding of the past, encapsulated in the motto of the 18th-century antiquary, Sir Richard Colt Hoare, ""We speak from facts not theory""."
18,"In his book published in 1088, Shen Kuo criticized contemporary Chinese scholars for attributing ancient bronze vessels as creations of famous sages rather than artisan commoners, and for attempting to revive them for ritual use without discerning their original functionality and purpose of manufacture."
19,"Flavio Biondo, an Italian Renaissance humanist historian, created a systematic guide to the ruins and topography of ancient Rome in the early 15th century, for which he has been called an early founder of archaeology."
20,"Antiquarians of the 16th century, including John Leland and William Camden, conducted surveys of the English countryside, drawing, describing and interpreting the monuments that they encountered."
22,"""Archaeology"", from 1607 onwards, initially meant what we would call ""ancient history"" generally, with the narrower modern sense first seen in 1837."
24,He was also ahead of his time in the analysis of his findings.
26,"The discovery of entire towns, complete with utensils and even human shapes, as well the unearthing of frescos, had a big impact throughout Europe."
27,"However, prior to the development of modern techniques, excavations tended to be haphazard; the importance of concepts such as stratification and context were overlooked."
29,"The idea of overlapping strata tracing back to successive periods was borrowed from the new geological and paleontological work of scholars like William Smith, James Hutton and Charles Lyell."
30,The application of stratigraphy to archaeology first took place with the excavations of prehistorical and Bronze Age sites.
31,"In the third and fourth decades of the 19th-century, archaeologists like Jacques Boucher de Perthes and Christian Jürgensen Thomsen began to put the artifacts they had found in chronological order."
32,"A major figure in the development of archaeology into a rigorous science was the army officer and ethnologist, Augustus Pitt Rivers, who began excavations on his land in England in the 1880s."
33,"His approach was highly methodical by the standards of the time, and he is widely regarded as the first scientific archaeologist."
34,"He arranged his artifacts by type or ""typologically, and within types by date or ""chronologically""."
35,"This style of arrangement, designed to highlight the evolutionary trends in human artifacts, was of enormous significance for the accurate dating of the objects."
36,"His painstaking recording and study of artifacts, both in Egypt and later in Palestine, laid down many of the ideas behind modern archaeological recording; he remarked that ""I believe the true line of research lies in the noting and comparison of the smallest details."""
37,"Petrie developed the system of dating layers based on pottery and ceramic findings, which revolutionized the chronological basis of Egyptology."
38,Petrie was the first to scientifically investigate the Great Pyramid in Egypt during the 1880s.
39,"He was also responsible for mentoring and training a whole generation of Egyptologists, including Howard Carter who went on to achieve fame with the discovery of the tomb of 14th-century BC pharaoh Tutankhamun."
40,"The first stratigraphic excavation to reach wide popularity with public was that of Hissarlik, on the site of ancient Troy, carried out by Heinrich Schliemann, Frank Calvert and Wilhelm Dörpfeld in the 1870s."
41,"These scholars individuated nine different cities that had overlapped with one another, from prehistory to the Hellenistic period."
42,"Wheeler developed the grid system of excavation, which was further improved by his student Kathleen Kenyon."
43,"Archaeology became a professional activity in the first half of the 20th century, and it became possible to study archaeology as a subject in universities and even schools."
44,"By the end of the 20th century nearly all professional archaeologists, at least in developed countries, were graduates."
45,"Further adaptation and innovation in archaeology continued in this period, when maritime archaeology and urban archaeology became more prevalent and rescue archaeology was developed as a result of increasing commercial development."
46,"Over 99% of the development of humanity has occurred within prehistoric cultures, who did not make use of writing, thereby no written records exist for study purposes."
47,"Without such written sources, the only way to understand prehistoric societies is through archaeology."
48,"Many important developments in human history occurred during prehistory, such as the evolution of humanity during the Paleolithic period, when the hominins developed from the australopithecines in Africa and eventually into modern Homo sapiens."
49,"Archaeology also sheds light on many of humanity's technological advances, for instance the ability to use fire, the development of stone tools, the discovery of metallurgy, the beginnings of religion and the creation of agriculture."
50,"For many literate cultures, such as Ancient Greece and Mesopotamia, their surviving records are often incomplete and biased to some extent."
51,"In many societies, literacy was restricted to the elite classes, such as the clergy or the bureaucracy of court or temple."
52,The literacy even of aristocrats has sometimes been restricted to deeds and contracts.
53,The interests and world-view of elites are often quite different from the lives and interests of the populace.
54,Writings that were produced by people more representative of the general population were unlikely to find their way into libraries and be preserved there for posterity.
55,"Thus, written records tend to reflect the biases, assumptions, cultural values and possibly deceptions of a limited range of individuals, usually a small fraction of the larger population."
56,"Hence, written records cannot be trusted as a sole source."
57,Across the millennia many thousands of cultures and societies and billions of people have come and gone of which there is little or no written record or existing records are misrepresentative or incomplete.
58,"Writing as it is known today did not exist in human civilization until the 4th millennium BC, in a relatively small number of technologically advanced civilizations."
60,"These civilizations are, not coincidentally, the best-known; they are open to the inquiry of historians for centuries, while the study of pre-historic cultures has arisen only recently."
61,Even within a literate civilization many events and important human practices are not officially recorded.
62,"Any knowledge of the early years of human civilization – the development of agriculture, cult practices of folk religion, the rise of the first cities – must come from archaeology."
63,"In addition to their scientific importance, archaeological remains sometimes have political or cultural significance to descendants of the people who produced them, monetary value to collectors, or simply strong aesthetic appeal."
64,"Many people identify archaeology with the recovery of such aesthetic, religious, political, or economic treasures rather than with the reconstruction of past societies."
65,"This view is often espoused in works of popular fiction, such as Raiders of the Lost Ark, The Mummy, and King Solomon's Mines."
66,"When such unrealistic subjects are treated more seriously, accusations of pseudoscience are invariably levelled at their proponents (see Pseudoarchaeology)."
67,"However, these endeavours, real and fictional, are not representative of modern archaeology."
68,"When archaeology developed in the late 19th century, the first approach to archaeological theory to be practiced was that of cultural-history archaeology, which held the goal of explaining why cultures changed and adapted rather than just highlighting the fact that they did, therefore emphasizing historical particularism."
69,"In the early 20th century, many archaeologists who studied past societies with direct continuing links to existing ones (such as those of Native Americans, Siberians, Mesoamericans etc.)"
70,"followed the direct historical approach, compared the continuity between the past and contemporary ethnic and cultural groups."
71,"In the 1960s, an archaeological movement largely led by American archaeologists like Lewis Binford and Kent Flannery arose that rebelled against the established cultural-history archaeology."
72,"It questioned processualism's appeals to scientific positivism and impartiality, and emphasized the importance of a more self-critical theoretical reflexivity."
73,"However, this approach has been criticized by processualists as lacking scientific rigor, and the validity of both processualism and post-processualism is still under debate."
74,"Before any practical work can begin, however, a clear objective as to what the archaeologists are looking to achieve must be agreed upon."
75,"This done, a site is surveyed to find out as much as possible about it and the surrounding area."
76,"Second, an excavation may take place to uncover any archaeological features buried under the ground."
77,"And, third, the information collected during the excavation is studied and evaluated in an attempt to achieve the original research objectives of the archaeologists."
78,"It is then considered good practice for the information to be published so that it is available to other archaeologists and historians, although this is sometimes neglected."
79,There are two types of remote sensing instruments—passive and active.
80,Passive instruments detect natural energy that is reflected or emitted from the observed scene.
81,Passive instruments sense only radiation emitted by the object being viewed or reflected by the object from a source other than the instrument.
82,Active instruments emit energy and record what is reflected.
83,Satellite imagery is an example of passive remote sensing.
85,Distance to the object is determined by recording the time between the transmitted and backscattered pulses and using the speed of light to calculate the distance travelled.
86,"Lidars can determine atmospheric profiles of aerosols, clouds, and other constituents of the atmosphere."
88,"By independently knowing the height of the platform with respect to the mean Earth's surface, the topography of the underlying surface can be determined."
89,Regional survey is the attempt to systematically locate previously unknown sites in a region.
90,"Site survey is the attempt to systematically locate features of interest, such as houses and middens, within a site."
91,Each of these two goals may be accomplished with largely the same methods.
92,Survey was not widely practiced in the early days of archaeology.
93,"Cultural historians and prior researchers were usually content with discovering the locations of monumental sites from the local populace, and excavating only the plainly visible features there."
94,"It requires relatively little time and expense, because it does not require processing large volumes of soil to search out artifacts."
95,"(Nevertheless, surveying a large region or site can be expensive, so archaeologists often employ sampling methods.)"
96,"As with other forms of non-destructive archaeology, survey avoids ethical issues (of particular concern to descendant peoples) associated with destroying a site through excavation."
97,"It is the only way to gather some forms of information, such as settlement patterns and settlement structure."
98,"Survey data are commonly assembled into maps, which may show surface features and/or artifact distribution."
99,The simplest survey technique is surface survey.
100,"It involves combing an area, usually on foot but sometimes with the use of mechanized transport, to search for features or artifacts visible on the surface."
101,"Surface survey cannot detect sites or features that are completely buried under earth, or overgrown with vegetation."
102,"Surface survey may also include mini-excavation techniques such as augers, corers, and shovel test pits."
103,"If no materials are found, the area surveyed is deemed sterile."
104,"Aerial survey is conducted using cameras attached to airplanes, balloons, UAVs, or even Kites."
105,A bird's-eye view is useful for quick mapping of large or complex sites.
106,Aerial photographs are used to document the status of the archaeological dig.
107,Aerial imaging can also detect many things not visible from the surface.
108,"Plants growing above a buried man made structure, such as a stone wall, will develop more slowly, while those above other types of features (such as middens) may develop more rapidly."
109,"Photographs of ripening grain, which changes colour rapidly at maturation, have revealed buried structures with great precision."
110,Aerial photographs taken at different times of day will help show the outlines of structures by changes in shadows.
111,"Magnetometers detect minute deviations in the Earth's magnetic field caused by iron artifacts, kilns, some types of stone structures, and even ditches and middens."
112,Devices that measure the electrical resistivity of the soil are also widely used.
113,Archaeological features whose electrical resistivity contrasts with that of surrounding soils can be detected and mapped.
114,"Some archaeological features (such as those composed of stone or brick) have higher resistivity than typical soils, while others (such as organic deposits or unfired clay) tend to have lower resistivity."
115,"Although some archaeologists consider the use of metal detectors to be tantamount to treasure hunting, others deem them an effective tool in archaeological surveying."
116,"Examples of formal archaeological use of metal detectors include musketball distribution analysis on English Civil War battlefields, metal distribution analysis prior to excavation of a 19th-century ship wreck, and service cable location during evaluation."
117,Metal detectorists have also contributed to archaeology where they have made detailed records of their results and refrained from raising artifacts from their archaeological context.
118,"In the UK, metal detectorists have been solicited for involvement in the Portable Antiquities Scheme."
119,"Regional survey in underwater archaeology uses geophysical or remote sensing devices such as marine magnetometer, side-scan sonar, or sub-bottom sonar."
120,"It can reveal several types of information usually not accessible to survey, such as stratigraphy, three-dimensional structure, and verifiably primary context."
121,"Modern excavation techniques require that the precise locations of objects and features, known as their provenance or provenience, be recorded."
122,"This always involves determining their horizontal locations, and sometimes vertical position as well (also see Primary Laws of Archaeology)."
123,"Likewise, their association, or relationship with nearby objects and features, needs to be recorded for later analysis."
124,This allows the archaeologist to deduce which artifacts and features were likely used together and which may be from different phases of activity.
125,"For example, excavation of a site reveals its stratigraphy; if a site was occupied by a succession of distinct cultures, artifacts from more recent cultures will lie above those from more ancient cultures."
126,"Excavation is the most expensive phase of archaeological research, in relative terms."
127,"Also, as a destructive process, it carries ethical concerns."
128,"As a result, very few sites are excavated in their entirety."
129,"Again the percentage of a site excavated depends greatly on the country and ""method statement"" issued."
130,Sampling is even more important in excavation than in survey.
131,"Sometimes large mechanical equipment, such as backhoes (JCBs), is used in excavation, especially to remove the topsoil (overburden), though this method is increasingly used with great caution."
132,"Following this rather dramatic step, the exposed area is usually hand-cleaned with trowels or hoes to ensure that all features are apparent."
133,The next task is to form a site plan and then use it to help decide the method of excavation.
134,Features dug into the natural subsoil are normally excavated in portions to produce a visible archaeological section for recording.
135,"A feature, for example a pit or a ditch, consists of two parts: the cut and the fill."
136,"The cut describes the edge of the feature, where the feature meets the natural soil."
138,"The fill is what the feature is filled with, and will often appear quite distinct from the natural soil."
139,The cut and fill are given consecutive numbers for recording purposes.
140,"Scaled plans and sections of individual features are all drawn on site, black and white and colour photographs of them are taken, and recording sheets are filled in describing the context of each."
141,All this information serves as a permanent record of the now-destroyed archaeology and is used in describing and interpreting the site.
142,"This process is known as post-excavation analysis, and is usually the most time-consuming part of an archaeological investigation."
143,It is not uncommon for final excavation reports for major sites to take years to be published.
144,"At a basic level of analysis, artifacts found are cleaned, catalogued and compared to published collections."
145,This comparison process often involves classifying them typologically and identifying other sites with similar artifact assemblages.
146,"However, a much more comprehensive range of analytical techniques are available through archaeological science, meaning that artifacts can be dated and their compositions examined."
147,"Bones, plants, and pollen collected from a site can all be analyzed using the methods of zooarchaeology, paleoethnobotany, palynology and stable isotopes while any texts can usually be deciphered."
148,"These techniques frequently provide information that would not otherwise be known, and therefore they contribute greatly to the understanding of a site."
149,"Photogrammetry is also used as an analytical tool, and digital topographical models have been combined with astronomical calculations to verify whether or not certain structures (such as pillars) were aligned with astronomical events such as the sun's position at a solstice."
150,Agent-based modeling and simulation can be used to better understand past social dynamics and outcomes.
151,Data mining can be applied to large bodies of archaeological 'grey literature'.
156,"In England, archaeologists have uncovered layouts of 14th century medieval villages, abandoned after crises such as the Black Death."
157,"In downtown New York City, archaeologists have exhumed the 18th century remains of the African Burial Ground."
158,"When remnants of the WWII Siegfried Line were being destroyed, emergency archaeological digs took place whenever any part of the line was removed, to further scientific knowledge and reveal details of the line's construction."
159,"The approach first gained prominence during the processual movement of the 1960s, and continues to be a vibrant component of post-processual and other current archaeological approaches."
160,Early ethnoarchaeological research focused on hunter-gatherer or foraging societies; today ethnoarchaeological research encompasses a much wider range of human behaviour.
161,In the context of the logical positivism of processualism with its goals of improving the scientific rigor of archaeological epistemologies the experimental method gained importance.
162,Experimental techniques remain a crucial component to improving the inferential frameworks for interpreting the archaeological record.
163,"It emphasizes the application of analytical techniques from physics, chemistry, and engineering."
164,It is a field of research that frequently focuses on the definition of the chemical composition of archaeological remains for source analysis.
165,"Archaeometry also investigates different spatial characteristics of features, employing methods such as space syntax techniques and geodesy as well as computer-based tools such as geographic information system technology."
166,Rare earth elements patterns may also be used.
167,"A relatively nascent subfield is that of archaeological materials, designed to enhance understanding of prehistoric and non-industrial culture through scientific analysis of the structure and properties of materials associated with human activity."
168,CRM archaeologists frequently examine archaeological sites that are threatened by development.
169,"Today, CRM accounts for most of the archaeological research done in the United States and much of that in western Europe as well."
170,"In the US, CRM archaeology has been a growing concern since the passage of the National Historic Preservation Act (NHPA) of 1966, and most taxpayers, scholars, and politicians believe that CRM has helped preserve much of that nation's history and prehistory that would have otherwise been lost in the expansion of cities, dams, and highways."
171,"Along with other statutes, the NHPA mandates that projects on federal land or involving federal funds or permits consider the effects of the project on each archaeological site."
172,The application of CRM in the United Kingdom is not limited to government-funded projects.
173,"Since 1990, PPG 16 has required planners to consider archaeology as a material consideration in determining applications for new development."
174,"As a result, numerous archaeological organizations undertake mitigation work in advance of (or during) construction work in archaeologically sensitive areas, at the developer's expense."
175,"In England, ultimate responsibility of care for the historic environment rests with the Department for Culture, Media and Sport in association with English Heritage."
176,"In Scotland, Wales and Northern Ireland, the same responsibilities lie with Historic Scotland, Cadw and the Northern Ireland Environment Agency respectively."
177,"In France, the Institut national du patrimoine (The National Institute of Cultural Heritage) trains curators specialized in archaeology."
178,Their mission is to enhance the objects discovered.
179,"The curator is the link between scientific knowledge, administrative regulations, heritage objects and the public."
180,"Among the goals of CRM are the identification, preservation, and maintenance of cultural sites on public and private lands, and the removal of culturally valuable materials from areas where they would otherwise be destroyed by human activity, such as proposed construction."
181,This study involves at least a cursory examination to determine whether or not any significant archaeological sites are present in the area affected by the proposed construction.
182,"If these do exist, time and money must be allotted for their excavation."
183,"If initial survey and/or test excavations indicate the presence of an extraordinarily valuable site, the construction may be prohibited entirely."
184,"Cultural resources management has, however, been criticized."
185,CRM is conducted by private companies that bid for projects by submitting proposals outlining the work to be done and an expected budget.
