,0
184,"If considered collectively, EU member states are the largest contributor of foreign aid in the world."
185,"These countries, primarily developing countries, include some who seek to one day become either a member state of the European Union, or more closely integrated with the European Union."
186,"The EU offers financial assistance to countries within the European Neighbourhood, so long as they meet the strict conditions of government reform, economic reform and other issues surrounding positive transformation."
187,"This process is normally underpinned by an Action Plan, as agreed by both Brussels and the target country."
188,International recognition of sustainable development as a key element is growing steadily.
189,"Its role was recognized in three major UN summits on sustainable development: the 1992 UN Conference on Environment and Development (UNCED) in Rio de Janeiro, Brazil; the 2002 World Summit on Sustainable Development (WSSD) in Johannesburg, South Africa; and the 2012 UN Conference on Sustainable Development (UNCSD) in Rio de Janeiro."
190,"Other key global agreements are the Paris Agreement and the 2030 Agenda for Sustainable Development (United Nations, 2015)."
191,"The SDGs recognize that all countries must stimulate action in the following key areas - people, planet, prosperity, peace and partnership - in order to tackle the global challenges that are crucial for the survival of humanity."
192,"EU development action is based on the European Consensus on Development, which was endorsed on 20 December 2005 by EU Member States, the council, the European Parliament and the commission."
193,It is applied from the principles of Capability approach and Rights-based approach to development.
194,Partnership and cooperation agreements are bilateral agreements with non-member nations.
195,Internal trade between the member states is aided by the removal of barriers to trade such as tariffs and border controls.
196,"The European Union represents all its members at the World Trade Organization (WTO), and acts on behalf of member states in any disputes."
197,The currency union represents 342 million EU citizens.
199,There is a significant variation in Nominal GDP per capita within individual EU states.
200,"The difference between the richest and poorest regions (281 NUTS-2 regions of the Nomenclature of Territorial Units for Statistics) ranged, in 2017, from 31% (Severozapaden, Bulgaria) of the EU28 average (€30,000) to 253% (Luxembourg), or from €4,600 to €92,600."
201,"The single market involves the free circulation of goods, capital, people, and services within the EU, and the customs union involves the application of a common external tariff on all goods entering the market."
202,"Once goods have been admitted into the market they cannot be subjected to customs duties, discriminatory taxes or import quotas, as they travel internally."
203,"The non-EU member states of Iceland, Norway, Liechtenstein and Switzerland participate in the single market but not in the customs union."
204,Until the drive towards economic and monetary union the development of the capital provisions had been slow.
205,Post-Maastricht there has been a rapidly developing corpus of ECJ judgements regarding this initially neglected freedom.
206,The free movement of capital is unique insofar as it is granted equally to non-member states.
207,"The free movement of persons means that EU citizens can move freely between member states to live, work, study or retire in another country."
208,"While services account for 60–70% of GDP, legislation in the area is not as developed as in other areas."
209,This lacuna has been addressed by the recently passed Directive on services in the internal market which aims to liberalise the cross border provision of services.
210,According to the Treaty the provision of services is a residual freedom that only applies if no other freedom is being exercised.
211,"In 1992, having negotiated the structure and procedures of a currency union, the member states signed the Maastricht Treaty and were legally bound to fulfil the agreed-on rules including the convergence criteria if they wanted to join the monetary union."
212,The states wanting to participate had first to join the European Exchange Rate Mechanism.
213,"In 1999 the currency union started, first as an accounting currency with eleven member states joining."
214,"In 2002, the currency was fully put into place, when euro notes and coins were issued and national currencies began to phase out in the eurozone, which by then consisted of 12 member states."
215,The eurozone (constituted by the EU member states which have adopted the euro) has since grown to 19 countries.
216,"The euro, and the monetary policies of those who have adopted it in agreement with the EU, are under the control of the European Central Bank (ECB)."
217,"The ECB is the central bank for the eurozone, and thus controls monetary policy in that area with an agenda to maintain price stability."
218,"To complement this framework, there is also a European Systemic Risk Board under the responsibility of the ECB."
219,Around 46% of the energy consumed was produced within the member states while 54% was imported.
220,There is a strong dependence on Russian energy that the EU has been attempting to reduce.
221,"Projects under TEN include the Channel Tunnel, LGV Est, the Fréjus Rail Tunnel, the Öresund Bridge, the Brenner Base Tunnel and the Strait of Messina Bridge."
222,The developing European transport policies will increase the pressure on the environment in many regions by the increased transport network.
223,"In the pre-2004 EU members, the major problem in transport deals with congestion and pollution."
224,"After the recent enlargement, the new states that joined since 2004 added the problem of solving accessibility to the transport agenda."
225,The Polish road network was upgraded such as the A4 autostrada.
226,"Galileo is a proposed Satellite navigation system, to be built by the EU and launched by the European Space Agency (ESA)."
227,"The Galileo project was launched partly to reduce the EU's dependency on the US-operated Global Positioning System, but also to give more complete global coverage and allow for greater accuracy, given the aged nature of the GPS system."
228,"The policy has the objectives of increasing agricultural production, providing certainty in food supplies, ensuring a high quality of life for farmers, stabilising markets, and ensuring reasonable prices for consumers."
229,"It was, until recently, operated by a system of subsidies and market intervention."
230,These were intervention stores of products bought up by the Community to maintain minimum price levels.
231,"To dispose of surplus stores, they were often sold on the world market at prices considerably below Community guaranteed prices, or farmers were offered subsidies (amounting to the difference between the Community and world prices) to export their products outside the Community."
232,"This system has been criticised for under-cutting farmers outside Europe, especially those in the developing world."
233,"Initially, these reforms included the introduction of set-aside in 1988, where a proportion of farm land was deliberately withdrawn from production, milk quotas and, more recently, the 'de-coupling' (or disassociation) of the money farmers receive from the EU and the amount they produce (by the Fischler reforms in 2004)."
234,"Agriculture expenditure will move away from subsidy payments linked to specific produce, toward direct payments based on farm size."
235,This is intended to allow the market to dictate production levels.
236,"One of these reforms entailed the modification of the EU's sugar regime, which previously divided the sugar market between member states and certain African-Caribbean nations with a privileged relationship with the EU."
237,"For example, in 2001 the commission for the first time prevented a merger between two companies based in the United States (GE and Honeywell) which had already been approved by their national authority."
238,"Another high-profile case against Microsoft, resulted in the Commission fining Microsoft over €777 million following nine years of legal action."
239,To this end it has adopted laws establishing minimum employment and environmental standards.
240,These included the Working Time Directive and the Environmental Impact Assessment Directive.
241,The EU has also sought to coordinate the social security and health systems of member states to facilitate individuals exercising free movement rights and to ensure they maintain their ability to access social security and health services in other member states.
243,A European unemployment insurance has been proposed among others by the commissioner of Jobs Nicolas Schmit.
244,A European Directive about Minimum Wage has also been discussedSince 2019 there is a European Commissioner for Equality; a European Institute for Gender Equality has existed since 2007.
245,Such regions are primarily located in the states of central and southern Europe.
246,"Several funds provide emergency aid, support for candidate members to transform their country to conform to the EU's standard (Phare, ISPA, and SAPARD), and support to the Commonwealth of Independent States (TACIS)."
247,TACIS has now become part of the worldwide EuropeAid programme.
248,"Demographic transition to a society of aging population, low fertility-rates and depopulation of non-metropolitan regions is tackled within this policies."
249,"Over the past 50 years, an increasingly dense network of legislation has been created, extending to all areas of environmental protection, including air pollution, water quality, waste management, nature conservation, and the control of chemicals, industrial hazards, and biotechnology."
250,"In subsequent years, the environment became a formal policy area, with its own policy actors, principles and procedures."
251,the role of the EU in securing the ratification and coming into force of the Kyoto Protocol despite opposition from the United States.
252,"This international dimension is reflected in the EU's Sixth Environmental Action Programme, which recognises that its objectives can only be achieved if key international agreements are actively supported and properly implemented both at EU level and worldwide."
253,The Lisbon Treaty further strengthened the leadership ambitions.
254,"In 2007, member states agreed that, in the future, 20% of the energy used across the EU must be renewable, and carbon dioxide emissions have to be lower in 2020 by at least 20% compared to 1990 levels."
255,The EU has adopted an emissions trading system to incorporate carbon emissions into the economy.
256,"The European Green Capital is an annual award given to cities that focuses on the environment, energy efficiency, and quality of life in urban areas to create smart city."
257,Almost all member states supported that goal at an EU summit in June 2019.
259,"In higher education, the policy was developed in the 1980s in programmes supporting exchanges and mobility."
260,"The most visible of these has been the Erasmus Programme, a university exchange programme which began in 1987."
261,These programmes are designed to encourage a wider knowledge of other countries and to spread good practices in the education and training fields across the EU.
262,"Through its support of the Bologna Process, the EU is supporting comparable standards and compatible degrees across Europe."
263,"Scientific development is facilitated through the EU's Framework Programmes, the first of which started in 1984."
264,The aims of EU policy in this area are to co-ordinate and stimulate research.
265,The independent European Research Council allocates EU funds to European or national research projects.
266,"EU research and technological framework programmes deal in a number of areas, for example energy where the aim is to develop a diverse mix of renewable energy to help the environment and to reduce dependence on imported fuels."
267,"In general, life expectancy is lower in Eastern Europe than in Western Europe."
269,The European Capital of Culture programme selects one or more cities in every year to assist the cultural development of that city.
270,"This followed lobbying by governing organisations such as the International Olympic Committee and FIFA, due to objections over the application of free market principles to sport, which led to an increasing gap between rich and poor clubs."
271,"The EU does fund a programme for Israeli, Jordanian, Irish, and British football coaches, as part of the Football 4 Peace project."
272,"Originally designed in 1955 for the Council of Europe, the flag was adopted by the European Communities, the predecessors of the present Union, in 1986."
274,"The number of stars is invariably twelve, the figure twelve being the symbol of perfection and entirety."
277,"The anthem of the Union is an instrumental version of the prelude to the Ode to Joy, the 4th movement of Ludwig van Beethoven's ninth symphony."
278,The anthem was adopted by European Community leaders in 1985 and has since been played on official occasions.
279,"Besides naming the continent, the Greek mythological figure of Europa has frequently been employed as a personification of Europe."
280,"Known from the myth in which Zeus seduces her in the guise of a white bull, Europa has also been referred to in relation to the present Union."
281,Statues of Europa and the bull decorate several of the Union's institutions and a portrait of her is seen on the 2013 series of Euro banknotes.
282,The commission has named one of its central buildings in Brussels after Charlemagne and the city of Aachen has since 1949 awarded the Charlemagne Prize to champions of European unification.
284,ARTE is a public Franco-German TV network that promotes programming in the areas of culture and the arts.
285,"It provides support for the development, promotion and distribution of European works within Europe and beyond."
287,"Scholar Thomas Risse wrote in 2009, ""there is a consensus in the literature on Eastern Europe that the EU membership perspective had a huge anchoring effects for the new democracies."""
288,"At the same time, the union provides an external constraint that prevents soft authoritarian regimes from progressing into hard dictatorships."
