,0
201,"Louis François, Dean of the History/Geography group in the Inspectorate of National Education advised that teachers should provide historic documents and promote ""active methods"" which would give pupils ""the immense happiness of discovery."""
202,Proponents said it was a reaction against the memorization of names and dates that characterized teaching and left the students bored.
203,Traditionalists protested loudly it was a postmodern innovation that threatened to leave the youth ignorant of French patriotism and national identity.
204,"For example, in Japan, mention of the Nanking Massacre has been removed from textbooks and the entire Second World War is given cursory treatment."
205,Other countries have complained.
206,"An example of content that is represented different in different regions of the country is the history of the Southern states, where slavery and the American Civil War are treated as controversial topics."
207,"The result is that ""German textbooks usually downplay national pride and ambitions and aim to develop an understanding of citizenship centered on democracy, progress, human rights, peace, tolerance and Europeanness."""
