,0
163,"Harvey made a detailed analysis of the overall structure of the heart, going on to an analysis of the arteries, showing how their pulsation depends upon the contraction of the left ventricle, while the contraction of the right ventricle propels its charge of blood into the pulmonary artery."
164,He noticed that the two ventricles move together almost simultaneously and not independently like had been thought previously by his predecessors.
165,"In the eighth chapter, Harvey estimated the capacity of the heart, how much blood is expelled through each pump of the heart, and the number of times the heart beats in half an hour."
166,"From these estimations, he demonstrated that according to Gaelen's theory that blood was continually produced in the liver, the absurdly large figure of 540 pounds of blood would have to be produced every day."
167,"Having this simple mathematical proportion at hand—which would imply a seemingly impossible role for the liver—Harvey went on to demonstrate how the blood circulated in a circle by means of countless experiments initially done on serpents and fish: tying their veins and arteries in separate periods of time, Harvey noticed the modifications which occurred; indeed, as he tied the veins, the heart would become empty, while as he did the same to the arteries, the organ would swell up."
168,This process was later performed on the human body (in the image on the left): the physician tied a tight ligature onto the upper arm of a person.
169,This would cut off blood flow from the arteries and the veins.
170,"When this was done, the arm below the ligature was cool and pale, while above the ligature it was warm and swollen."
171,"The ligature was loosened slightly, which allowed blood from the arteries to come into the arm, since arteries are deeper in the flesh than the veins."
172,"When this was done, the opposite effect was seen in the lower arm."
173,It was now warm and swollen.
174,"The veins were also more visible, since now they were full of blood."
175,Various other advances in medical understanding and practice were made.
176,"French physician Pierre Fauchard started dentistry science as we know it today, and he has been named ""the father of modern dentistry""."
177,The importance of chemistry is indicated by the range of important scholars who actively engaged in chemical research.
178,"Among them were the astronomer Tycho Brahe, the chemical physician Paracelsus, Robert Boyle, Thomas Browne and Isaac Newton."
179,"His work describes the highly developed and complex processes of mining metal ores, metal extraction and metallurgy of the time."
180,"Although his research clearly has its roots in the alchemical tradition, Boyle is largely regarded today as the first modern chemist, and therefore one of the founders of modern chemistry, and one of the pioneers of modern experimental scientific method."
181,"In the work, Boyle presents his hypothesis that every phenomenon was the result of collisions of particles in motion."
182,"Boyle appealed to chemists to experiment and asserted that experiments denied the limiting of chemical elements to only the classic four: earth, fire, air, and water."
183,"He also pleaded that chemistry should cease to be subservient to medicine or to alchemy, and rise to the status of a science."
184,"Importantly, he advocated a rigorous approach to scientific experiment: he believed all theories must be tested experimentally before being regarded as true."
185,"The work contains some of the earliest modern ideas of atoms, molecules, and chemical reaction, and marks the beginning of the history of modern chemistry."
186,Johannes Kepler published Astronomiae Pars Optica (The Optical Part of Astronomy) in 1604.
187,"In it, he described the inverse-square law governing the intensity of light, reflection by flat and curved mirrors, and principles of pinhole cameras, as well as the astronomical implications of optics such as parallax and the apparent sizes of heavenly bodies."
188,the angle subtended at the eye by the edge of the rainbow and the rainbow's centre is 42°).
189,"He also independently discovered the law of reflection, and his essay on optics was the first published mention of this law."
191,"These included the Opera reliqua (also known as Christiani Hugenii Zuilichemii, dum viveret Zelhemii toparchae, opuscula posthuma) and the Traité de la lumière."
192,"Isaac Newton investigated the refraction of light, demonstrating that a prism could decompose white light into a spectrum of colours, and that a lens and a second prism could recompose the multicoloured spectrum into white light."
193,He also showed that the coloured light does not change its properties by separating out a coloured beam and shining it on various objects.
194,"Newton noted that regardless of whether it was reflected or scattered or transmitted, it stayed the same colour."
195,"Thus, he observed that colour is the result of objects interacting with already-coloured light rather than objects generating the colour themselves."
196,This is known as Newton's theory of colour.
197,From this work he concluded that any refracting telescope would suffer from the dispersion of light into colours.
198,The interest of the Royal Society encouraged him to publish his notes On Colour (later expanded into Opticks).
199,"Newton argued that light is composed of particles or corpuscles and were refracted by accelerating toward the denser medium, but he had to associate them with waves to explain the diffraction of light."
200,"In his Hypothesis of Light of 1675, Newton posited the existence of the ether to transmit forces between particles."
201,"In 1704, Newton published Opticks, in which he expounded his corpuscular theory of light."
202,"Gilbert also discovered that a heated body lost its electricity and that moisture prevented the electrification of all bodies, due to the now well-known fact that moisture impaired the insulation of such bodies."
203,"He also noticed that electrified substances attracted all other substances indiscriminately, whereas a magnet only attracted iron."
204,The many discoveries of this nature earned for Gilbert the title of founder of the electrical science.
205,"By investigating the forces on a light metallic needle, balanced on a point, he extended the list of electric bodies, and found also that many substances, including metals and natural magnets, showed no attractive forces when rubbed."
206,He left a detailed account of his researches under the title of Experiments on the Origin of Electricity.
207,"Boyle, in 1675, stated that electric attraction and repulsion can act across a vacuum."
208,"One of his important discoveries was that electrified bodies in a vacuum would attract light substances, this indicating that the electrical effect did not depend upon the air as a medium."
209,"By the end of the 17th century, researchers had developed practical means of generating electricity by friction with an electrostatic generator, but the development of electrostatic machines did not begin in earnest until the 18th century, when they became fundamental instruments in the studies about the new science of electricity."
210,"The first usage of the word electricity is ascribed to Sir Thomas Browne in his 1646 work, Pseudodoxia Epidemica."
212,With the help of the prominent mathematician Henry Briggs their logarithmic tables embodied a computational advance that made calculations by hand much quicker.
213,His Napier's bones used a set of numbered rods as a multiplication tool using the system of lattice multiplication.
214,"The way was opened to later scientific advances, particularly in astronomy and dynamics."
215,"At Oxford University, Edmund Gunter built the first analog device to aid computation."
216,"The 'Gunter's scale' was a large plane scale, engraved with various scales, or lines."
217,"Natural lines, such as the line of chords, the line of sines and tangents are placed on one side of the scale and the corresponding artificial or logarithmic ones were on the other side."
218,This calculating aid was a predecessor of the slide rule.
221,The introduction of his Pascaline in 1645 launched the development of mechanical calculators first in Europe and then all over the world.
225,He developed a method of producing high-grade iron in a blast furnace fueled by coke rather than charcoal.
226,This was a major step forward in the production of iron as a raw material for the Industrial Revolution.
227,"The inventor is unknown but Hans Lippershey applied for the first patent, followed by Jacob Metius of Alkmaar."
228,"He argued that a mirror shaped like the part of a conic section, would correct the spherical aberration that flawed the accuracy of refracting telescopes."
229,"His design, the ""Gregorian telescope"", however, remained un-built."
230,"In 1666, Isaac Newton argued that the faults of the refracting telescope were fundamental because the lens refracted light of different colors differently."
231,He concluded that light could not be refracted through a lens without causing chromatic aberrations.
232,From these experiments Newton concluded that no improvement could be made in the refracting telescope.
233,"However, he was able to demonstrate that the angle of reflection remained the same for all colors, so he decided to build a reflecting telescope."
234,These were successfully demonstrated to the Royal Society.
235,The first such device was made by Otto von Guericke in 1654.
236,It consisted of a piston and an air gun cylinder with flaps that could suck the air from any vessel that it was connected to.
237,"In 1657, he pumped the air out of two conjoined hemispheres and demonstrated that a team of sixteen horses were incapable of pulling it apart."
238,The motivation for the invention was to improve on the suction pumps that were used to raise water out of the mines.
239,"Torricelli constructed a sealed tube filled with mercury, set vertically into a basin of the same substance."
240,"The column of mercury fell downwards, leaving a Torricellian vacuum above."
241,"Those instruments that exist in collections today tend to be robust examples, made by skilled craftspeople for and at the expense of wealthy patrons."
242,These may have been commissioned as displays of wealth.
243,"In addition, the instruments preserved in collections may not have received heavy use in scientific work; instruments that had visibly received heavy use were typically destroyed, deemed unfit for display, or excluded from collections altogether."
244,"The pump at right included a glass sphere to permit demonstrations inside the vacuum chamber, a common use."
245,"The base was wooden, and the cylindrical pump was brass."
246,"The increase in uses for such instruments, and their widespread use in global exploration and conflict, created a need for new methods of manufacture and repair, which would be met by the Industrial Revolution."
249,He found that the circulation of blood resolved from pumping of the heart.
250,He also assembled the first human skeleton from cutting open cadavers.
251,"The French mathematician François Viète (1540–1603) published In Artem Analycitem Isagoge (1591), which gave the first symbolic notation of parameters in literal algebra."
254,These became the basic data for Kepler's studies.
256,This contributed to the development of what became known as the scientific method.
258,He developed the laws for falling bodies based on pioneering quantitative experiments which he analyzed mathematically.
265,"He showed that an inverse square law for gravity explained the elliptical orbits of the planets, and advanced the law of universal gravitation."
266,His development of infinitesimal calculus (along with Leibniz) opened up new applications of the methods of mathematics to science.
267,"Newton taught that scientific theory should be coupled with rigorous experimentation, which became the keystone of modern science."
268,"A weakness of the idea of scientific revolution is the lack of a systematic approach to the question of knowledge in the period comprehended between the 14th and 17th centuries, leading to misunderstandings on the value and role of modern authors."
269,"Thus, the idea of a scientific revolution following the Renaissance is—according to the continuity thesis—a myth."
270,"Bala proposes that the changes involved in the Scientific Revolution—the mathematical realist turn, the mechanical philosophy, the atomism, the central role assigned to the Sun in Copernican heliocentrism—have to be seen as rooted in multicultural influences on Europe."
271,"In the ultimate analysis, even if the revolution was rooted upon a multicultural base it is the accomplishment of Europeans in Europe."""
272,A closer study of Greek philosophy and Greek mathematics demonstrates that nearly all of the so-called revolutionary results of the so-called scientific revolution were in actuality restatements of ideas that were in many cases older than those of Aristotle and in nearly all cases at least as old as Archimedes.
273,"Aristotle even explicitly argues against some of the ideas that were espoused during the Scientific Revolution, such as heliocentrism."
274,"The basic ideas of the scientific method were well known to Archimedes and his contemporaries, as demonstrated in the well-known discovery of buoyancy."
275,Atomism was first thought of by Leucippus and Democritus.
276,This approach to the Scientific Revolution reduces it to a period of relearning classical ideas that is very much an extension of the Renaissance.
277,This view does not deny that a change occurred but argues that it was a reassertion of previous knowledge (a renaissance) and not the creation of new knowledge.
278,"Female scholars were not always given the opportunities that a male scholar would have had, and the incorporation of women's work in the sciences during this time tends to be obscured."
279,"Scholars have tried to look into the participation of women in the 17th century in science, and even with sciences as simple as domestic knowledge women were making advances."
280,With the limited history provided from texts of the period we are not completely aware if women were helping these scientists develop the ideas they did.
281,Another idea to consider is the way this period influenced even the women scientists of the periods following it.
282,Annie Jump Cannon was an astronomer who benefitted from the laws and theories developed from this period; she made several advances in the century following the Scientific Revolution.
283,"It was an important period for the future of science, including the incorporation of women into fields using the developments made."
