,0
0,"The Scientific Revolution was a series of events that marked the emergence of modern science during the early modern period, when developments in mathematics, physics, astronomy, biology (including human anatomy) and chemistry transformed the views of society about nature."
1,"The Scientific Revolution took place in Europe towards the end of the Renaissance period and continued through the late 18th century, influencing the intellectual social movement known as the Enlightenment."
2,"The beginning of the Scientific Revolution, the 'Scientific Renaissance', was focused on the recovery of the knowledge of the ancients; this is generally considered to have ended in 1632 with publication of Galileo's Dialogue Concerning the Two Chief World Systems."
3,"The completion of the Scientific Revolution is attributed to the ""grand synthesis"" of Isaac Newton's 1687 Principia."
4,"The work formulated the laws of motion and universal gravitation, thereby completing the synthesis of a new cosmology."
5,"By the end of the 18th century, the Age of Enlightenment that followed the Scientific Revolution had given way to the ""Age of Reflection""."
6,"In 1747, the French mathematician Alexis Clairaut wrote that ""Newton was said in his own life to have created a revolution""."
7,The word was also used in the preface to  Antoine Lavoisier's 1789 work announcing the discovery of oxygen.
8,"""In the 19th century, William Whewell described the revolution in science itself – the scientific method – that had taken place in the 15th-16th century."
9,"""Among the most conspicuous of the revolutions which opinions on this subject have undergone, is the transition from an implicit trust in the internal powers of man's mind to a professed dependence upon external observation; and from an unbounded reverence for the wisdom of the past, to a fervid expectation of change and improvement."""
11,"Science became an autonomous discipline, distinct from both philosophy and technology and came to be regarded as having utilitarian goals."
12,"The Scientific Revolution is traditionally assumed to start with the Copernican Revolution (initiated in 1543) and to be complete in the ""grand synthesis"" of Isaac Newton's 1687 Principia."
13,"Much of the change of attitude came from Francis Bacon whose ""confident and emphatic announcement"" in the modern progress of science inspired the creation of scientific societies such as the Royal Society, and Galileo who championed Copernicus and developed the science of motion."
14,"In the 20th century, Alexandre Koyré introduced the term ""scientific revolution"", centering his analysis on Galileo."
15,The term was popularized by Butterfield in his Origins of Modern Science.
16,"Thomas Kuhn's 1962 work The Structure of Scientific Revolutions emphasized that different theoretical frameworks—such as Einstein's theory of relativity and Newton's theory of gravity, which it replaced—cannot be directly compared without meaning loss."
19,"The new kind of scientific activity emerged only in a few countries of Western Europe, and it was restricted to that small area for about two hundred years."
21,Many contemporary writers and modern historians claim that there was a revolutionary change in world view.
24,"Not only were many of the key figures in the rise of science individuals with sincere religious commitments, but the new approaches to nature that they pioneered were underpinned in various ways by religious assumptions."
25,"Yet, many of the leading figures in the scientific revolution imagined themselves to be champions of a science that was more compatible with Christianity than the medieval ideas about the natural world that they replaced."
26,"Some scholars have noted a direct tie between ""particular aspects of traditional Christianity"" and the rise of science."
27,"The ""Aristotelian tradition"" was still an important intellectual framework in the 17th century, although by that time natural philosophers had moved away from much of it."
28,"Key scientific ideas dating back to classical antiquity had changed drastically over the years, and in many cases been discredited."
30,The terrestrial and celestial regions were made up of different elements which had different kinds of natural movement.
31,"The terrestrial region, according to Aristotle, consisted of concentric spheres of the four elements—earth, water, air, and fire."
32,All bodies naturally moved in straight lines until they reached the sphere appropriate to their elemental composition—their natural place.
33,"All other terrestrial motions were non-natural, or violent."
34,"The celestial region was made up of the fifth element, aether, which was unchanging and moved naturally with uniform circular motion."
35,"In the Aristotelian tradition, astronomical theories sought to explain the observed irregular motion of celestial objects through the combined effects of multiple uniform circular motions."
36,"The Ptolemaic model of planetary motion: based on the geometrical model of Eudoxus of Cnidus, Ptolemy's Almagest, demonstrated that calculations could compute the exact positions of the Sun, Moon, stars, and planets in the future and in the past, and showed how these computational models were derived from astronomical observations."
37,As such they formed the model for later astronomical developments.
38,"Meanwhile, however, significant progress in geometry, mathematics, and astronomy was made in medieval times."
39,It is also true that many of the important figures of the Scientific Revolution shared in the general Renaissance respect for ancient learning and cited ancient pedigrees for their innovations.
40,"Nicolaus Copernicus (1473–1543), Galileo Galilei (1564–1642), Johannes Kepler (1571–1630) and Isaac Newton (1642–1727) all traced different ancient and medieval ancestries for the heliocentric system."
41,"In the Axioms Scholium of his Principia, Newton said its axiomatic three laws of motion were already accepted by mathematicians such as Christiaan Huygens (1629–1695), Wallace, Wren and others."
42,"Not only were there revolutionary theoretical and experimental developments, but that even more importantly, the way in which scientists worked was radically changed."
43,"For instance, although intimations of the concept of inertia are suggested sporadically in ancient discussion of motion, the salient point is that Newton's theory differed from ancient understandings in key ways, such as an external force being a requirement for violent motion in Aristotle's theory."
44,"The philosophy of using an inductive approach to obtain knowledge—to abandon assumption and to attempt to observe with an open mind—was in contrast with the earlier, Aristotelian approach of deduction, by which analysis of known facts produced further understanding."
45,"In practice, many scientists and philosophers believed that a healthy mix of both was needed—the willingness to question assumptions, yet also to interpret observations assumed to have some degree of validity."
46,"By the end of the Scientific Revolution the qualitative world of book-reading philosophers had been changed into a mechanical, mathematical world to be known through experimental research."
47,"Though it is certainly not true that Newtonian science was like modern science in all respects, it conceptually resembled ours in many ways."
48,"Many of the hallmarks of modern science, especially with regard to its institutionalization and professionalization, did not become standard until the mid-19th century."
49,"Coupled with this approach was the belief that rare events which seemed to contradict theoretical models were aberrations, telling nothing about nature as it ""naturally"" was."
50,"During the Scientific Revolution, changing perceptions about the role of the scientist in respect to nature, the value of evidence, experimental or observed, led towards a scientific methodology in which empiricism played a large, but not absolute, role."
51,"By the start of the Scientific Revolution, empiricism had already become an important component of science and natural philosophy."
52,"Thomas Hobbes, George Berkeley, and David Hume were the philosophy's primary exponents, who developed a sophisticated empirical tradition as the basis of human knowledge."
53,"An influential formulation of empiricism was John Locke's An Essay Concerning Human Understanding (1689), in which he maintained that the only true knowledge that could be accessible to the human mind was that which was based on experience."
54,"He wrote that the human mind was created as a tabula rasa, a ""blank tablet,"" upon which sensory impressions were recorded and built up knowledge through a process of reflection."
55,"His works established and popularised inductive methodologies for scientific inquiry, often called the Baconian method, or simply the scientific method."
56,"His demand for a planned procedure of investigating all things natural marked a new turn in the rhetorical and theoretical framework for science, much of which still surrounds conceptions of proper methodology today."
57,"Bacon proposed a great reformation of all process of knowledge for the advancement of learning divine and human, which he called Instauratio Magna (The Great Instauration)."
58,"For Bacon, this reformation would lead to a great advancement in science and a progeny of new inventions that would relieve mankind's miseries and needs."
60,"He argued that man is ""the minister and interpreter of nature"", that ""knowledge and human power are synonymous"", that ""effects are produced by the means of instruments and helps"", and that ""man while operating can only apply or withdraw natural bodies; nature internally performs the rest"", and later that ""nature can only be commanded by obeying her""."
61,"Here is an abstract of the philosophy of this work, that by the knowledge of nature and the using of instruments, man can govern or direct the natural work of nature to produce definite results."
62,"Therefore, that man, by seeking knowledge of nature, can reach power over it—and thus reestablish the ""Empire of Man over creation"", which had been lost by the Fall together with man's original purity."
63,"For him, the philosopher should proceed through inductive reasoning from fact to axiom to physical law."
64,"Before beginning this induction, though, the enquirer must free his or her mind from certain false notions or tendencies which distort the truth."
65,"In particular, he found that philosophy was too preoccupied with words, particularly discourse and debate, rather than actually observing the material world: ""For while men believe their reason governs words, in fact, words turn back and reflect their power upon the understanding, and so render philosophy and science sophistical and inactive."
66,"""Bacon considered that it is of greatest importance to science not to keep doing intellectual discussions or seeking merely contemplative aims, but that it should work for the bettering of mankind's life by bringing forth new inventions, having even stated that ""inventions are also, as it were, new creations and imitations of divine works""."
67,"He explored the far-reaching and world-changing character of inventions, such as the printing press, gunpowder and the compass."
68,"Despite his influence on scientific methodology, he himself rejected correct novel theories such as William Gilbert's magnetism, Copernicus's heliocentrism, and Kepler's  laws of planetary motion."
69,"There remains simple experience; which, if taken as it comes, is called accident, if sought for, experiment."
70,"The true method of experience first lights the candle [hypothesis], and then by means of the candle shows the way [arranges and delimits the experiment]; commencing as it does with experience duly ordered and digested, not bungling or erratic, and from it deducing axioms [theories], and from established axioms again new experiments."
71,William Gilbert was an early advocate of this method.
72,He passionately rejected both the prevailing Aristotelian philosophy and the Scholastic method of university teaching.
73,"His book De Magnete was written in 1600, and he is regarded by some as the father of electricity and magnetism."
74,"In this work, he describes many of his experiments with his model Earth called the terrella."
75,"From these experiments, he concluded that the Earth was itself magnetic and that this was the reason compasses point north."
76,"De Magnete was influential not only because of the inherent interest of its subject matter, but also for the rigorous way in which Gilbert described his experiments and his rejection of ancient theories of magnetism."
77,"It is the more remarkable, because it preceded the Novum Organum of Bacon, in which the inductive method of philosophizing was first explained."
78,"""Galileo Galilei has been called the ""father of modern observational astronomy"", the ""father of modern physics"", the ""father of science"", and ""the Father of Modern Science""."
79,His original contributions to the science of motion were made through an innovative combination of experiment and mathematics.
80,Galileo was one of the first modern thinkers to clearly state that the laws of nature are mathematical.
81,He ignored Aristotelianism.
82,"In broader terms, his work marked another step towards the eventual separation of science from both philosophy and religion; a major development in human thought."
83,He was often willing to change his views in accordance with observation.
84,"In order to perform his experiments, Galileo had to set up standards of length and time, so that measurements made on different days and in different laboratories could be compared in a reproducible fashion."
85,This provided a reliable foundation on which to confirm mathematical laws using inductive reasoning.
86,"Galileo showed an appreciation for the relationship between mathematics, theoretical physics, and experimental physics."
87,"He understood the parabola, both in terms of conic sections and in terms of the ordinate (y) varying as the square of the abscissa (x)."
88,Galilei further asserted that the parabola was the theoretically ideal trajectory of a uniformly accelerated projectile in the absence of friction and other disturbances.
89,"He conceded that there are limits to the validity of this theory, noting on theoretical grounds that a projectile trajectory of a size comparable to that of the Earth could not possibly be a parabola, but he nevertheless maintained that for distances up to the range of the artillery of his day, the deviation of a projectile's trajectory from a parabola would be only very slight."
90,"To the extent that medieval natural philosophers used mathematical problems, they limited social studies to theoretical analyses of local speed and other aspects of life."
91,"It is written in the language of mathematics, and its characters are triangles, circles, and other geometrical figures, without which it is humanly impossible to understand a single word of it; without these, one is wandering around in a dark labyrinth."
92,"The final cause was the aim, goal, or purpose of some natural process or man-made thing."
93,"Until the Scientific Revolution, it was very natural to see such aims, such as a child's growth, for example, leading to a mature adult."
94,Intelligence was assumed only in the purpose of man-made artifacts; it was not attributed to other animals or to nature.
95,"In ""mechanical philosophy"" no field or action at a distance is permitted, particles or corpuscles of matter are fundamentally inert."
96,Motion is caused by direct physical collision.
97,"Where natural substances had previously been understood organically, the mechanical philosophers viewed them as machines."
98,"As a result, Isaac Newton's theory seemed like some kind of throwback to ""spooky action at a distance""."
99,"Innate attractions and repulsions joined size, shape, position and motion as physically irreducible primary properties of matter."
100,"Newton had also specifically attributed the inherent power of inertia to matter, against the mechanist thesis that matter has no inherent powers."
101,"But whereas Newton vehemently denied gravity was an inherent power of matter, his collaborator Roger Cotes made gravity also an inherent power of matter, as set out in his famous preface to the Principia's 1713 second edition which he edited, and contradicted Newton himself."
102,And it was Cotes's interpretation of gravity rather than Newton's that came to be accepted.
103,The first scientific society to be established was the Royal Society of London.
104,"This grew out of an earlier group, centred around Gresham College in the 1640s and 1650s."
106,"These physicians and natural philosophers were influenced by the ""new science"", as promoted by Francis Bacon in his New Atlantis, from approximately 1645 onwards."
107,"At the second meeting, Robert Moray announced that the King approved of the gatherings, and a Royal charter was signed on 15 July 1662 creating the ""Royal Society of London"", with Lord Brouncker serving as the first President."
108,"A second Royal Charter was signed on 23 April 1663, with the King noted as the Founder and with the name of ""the Royal Society of London for the Improvement of Natural Knowledge""; Robert Hooke was appointed as Curator of Experiments in November."
109,"This initial royal favour has continued, and since then every monarch has been the patron of the Society."
110,The Society's first Secretary was Henry Oldenburg.
111,"Its early meetings included experiments performed first by Robert Hooke and then by Denis Papin, who was appointed in 1684."
112,"These experiments varied in their subject area, and were both important in some cases and trivial in others."
113,"In contrast to the private origins of its British counterpart, the Academy was founded as a government body by Jean-Baptiste Colbert."
114,"Its rules were set down in 1699 by King Louis XIV, when it received the name of 'Royal Academy of Sciences' and was installed in the Louvre in Paris."
115,Many of them were revolutions in their own fields.
116,"In Aristotle's cosmology, Earth's central location was perhaps less significant than its identification as a realm of imperfection, inconstancy, irregularity and change, as opposed to the ""heavens"" (Moon, Sun, planets, stars), which were regarded as perfect, permanent, unchangeable, and in religious thought, the realm of heavenly beings."
117,"The Earth was even composed of different material, the four elements ""earth"", ""water"", ""fire"", and ""air"", while sufficiently far above its surface (roughly the Moon's orbit), the heavens were composed of different substance called ""aether""."
118,"The heliocentric model that replaced it involved not only the radical displacement of the earth to an orbit around the sun, but its sharing a placement with the other planets implied a universe of heavenly components made from the same changeable substances as the Earth."
119,"Heavenly motions no longer needed to be governed by a theoretical perfection, confined to circular orbits."
120,Copernicus' 1543 work on the heliocentric model of the solar system tried to demonstrate that the sun was the center of the universe.
121,"Few were bothered by this suggestion, and the pope and several archbishops were interested enough by it to want more detail."
122,His model was later used to create the calendar of Pope Gregory XIII.
123,"However, the idea that the earth moved around the sun was doubted by most of Copernicus' contemporaries."
124,"It contradicted not only empirical observation, due to the absence of an observable stellar parallax, but more significantly at the time, the authority of Aristotle."
125,The discoveries of Johannes Kepler and Galileo gave the theory credibility.
126,"Kepler was an astronomer who, using the accurate observations of Tycho Brahe, proposed that the planets move around the sun not in circular orbits, but in elliptical ones."
127,"Together with his other laws of planetary motion, this allowed him to create a model of the solar system that was an improvement over Copernicus' original system."
128,"Galileo's main contributions to the acceptance of the heliocentric system were his mechanics, the observations he made with his telescope, as well as his detailed presentation of the case for the system."
129,"Using an early theory of inertia, Galileo could explain why rocks dropped from a tower fall straight down even if the earth rotates."
130,"His observations of the moons of Jupiter, the phases of Venus, the spots on the sun, and mountains on the moon all helped to discredit the Aristotelian philosophy and the Ptolemaic theory of the solar system."
131,"Through their combined discoveries, the heliocentric system gained support, and at the end of the 17th century it was generally accepted by astronomers."
132,This work culminated in the work of Isaac Newton.
133,"Newton's Principia formulated the laws of motion and universal gravitation, which dominated scientists' view of the physical universe for the next three centuries."
134,"By deriving Kepler's laws of planetary motion from his mathematical description of gravity, and then using the same principles to account for the trajectories of comets, the tides, the precession of the equinoxes, and other phenomena, Newton removed the last doubts about the validity of the heliocentric model of the cosmos."
135,This work also demonstrated that the motion of objects on Earth and of celestial bodies could be described by the same principles.
136,His prediction that the Earth should be shaped as an oblate spheroid was later vindicated by other scientists.
137,His laws of motion were to be the solid foundation of mechanics; his law of universal gravitation combined terrestrial and celestial mechanics into one great system that seemed to be able to describe the whole world in mathematical formulae.
139,"In 1679, Newton began to consider gravitation and its effect on the orbits of planets with reference to Kepler's laws of planetary motion."
140,"This followed stimulation by a brief exchange of letters in 1679–80 with Robert Hooke, who had been appointed to manage the Royal Society's correspondence, and who opened a correspondence intended to elicit contributions from Newton to Royal Society transactions."
141,"Newton's reawakening interest in astronomical matters received further stimulus by the appearance of a comet in the winter of 1680–1681, on which he corresponded with John Flamsteed."
142,"After the exchanges with Hooke, Newton worked out proof that the elliptical form of planetary orbits would result from a centripetal force inversely proportional to the square of the radius vector (see Newton's law of universal gravitation – History and De motu corporum in gyrum)."
143,"Newton communicated his results to Edmond Halley and to the Royal Society in De motu corporum in gyrum, in 1684."
144,"In this work, Newton stated the three universal laws of motion that contributed to many advances during the Industrial Revolution which soon followed and were not to be improved upon for more than 200 years."
145,Many of these advancements continue to be the underpinnings of non-relativistic technologies in the modern world.
146,"He used the Latin word gravitas (weight) for the effect that would become known as gravity, and defined the law of universal gravitation."
147,"Newton's postulate of an invisible force able to act over vast distances led to him being criticised for introducing ""occult agencies"" into science."
148,"Later, in the second edition of the Principia (1713), Newton firmly rejected such criticisms in a concluding General Scholium, writing that it was enough that the phenomena implied a gravitational attraction, as they did; but they did not so far indicate its cause, and it was both unnecessary and improper to frame hypotheses of things that were not implied by the phenomena."
150,The Flemish scholar Vesalius demonstrated mistakes in the Galen's ideas.
151,"Vesalius dissected human corpses, whereas Galen dissected animal corpses."
152,"Published in 1543, Vesalius' De humani corporis fabrica was a groundbreaking work of human anatomy."
153,"It emphasized the priority of dissection and what has come to be called the ""anatomical"" view of the body, seeing human internal functioning as an essentially corporeal structure filled with organs arranged in three-dimensional space."
154,"This was in stark contrast to many of the anatomical models used previously, which had strong Galenic/Aristotelean elements, as well as elements of astrology."
155,"Besides the first good description of the sphenoid bone, he showed that the sternum consists of three portions and the sacrum of five or six; and described accurately the vestibule in the interior of the temporal bone."
156,"He not only verified the observation of Etienne on the valves of the hepatic veins, but he described the vena azygos, and discovered the canal which passes in the fetus between the umbilical vein and the vena cava, since named ductus venosus."
159,"Before Vesalius, the anatomical notes by Alessandro Achillini demonstrate a detailed description of the human body and compares what he has found during his dissections to what others like Galen and Avicenna have found and notes their similarities and differences."
160,"Niccolò Massa was an Italian anatomist who wrote an early anatomy text Anatomiae Libri Introductorius in 1536, described the cerebrospinal fluid and was the author of several medical works."
161,"Jean Fernel was a French physician who introduced the term ""physiology"" to describe the study of the body's function and was the first person to describe the spinal canal."
162,"Further groundbreaking work was carried out by William Harvey, who published De Motu Cordis in 1628."
