,0
525,"Food is traditionally conserved by salting, such as Spanish ham, or immersed in olive oil, such as Manchego cheese."
528,"The best known cuisine of the northern countries often rely on ocean seafood, as in the Basque-style cod, albacore or anchovy or the Galician octopus-based polbo á feira and shellfish dishes."
529,and FC Barcelona are two of the most successful football clubs in the world.
531,"The tourism industry has led to an improvement in sports infrastructure, especially for water sports, golf and skiing."
532,"In their respective regions, the traditional games of Basque pelota and Valencian pilota both are popular."
533,Each municipality is allowed to declare a maximum of 14 public holidays per year; up to nine of these are chosen by the national government and at least two are chosen locally.
534,"Some of them are known worldwide, and millions of tourits from all over the world go to Spain annually to experience one of these festivals."
535,"One of the most famous is San Fermín, in Pamplona."
536,"While its most famous event is the encierro, or the running of the bulls, which happens at 8:00 am from 7 July to 14 July, the seven days-long celebration involves many other traditional and folkloric events."
537,"The events were central to the plot of The Sun Also Rises, by Ernest Hemingway, which brought it to the general attention of English-speaking people."
