,0
1,Its continental European territory is situated on the Iberian Peninsula.
2,"Its territory also includes two archipelagos: the Canary Islands off the coast of North Africa, and the Balearic Islands in the Mediterranean Sea."
4,Several small islands in the Alboran Sea are also part of Spanish territory.
5,"The country's mainland is bordered to the south and east by the Mediterranean Sea; to the north and northeast by France, Andorra, and the Bay of Biscay; and to the west and northwest by Portugal and the Atlantic Ocean respectively."
7,"Spain's capital and largest city is Madrid; other major urban areas include Barcelona, Valencia, Seville, Zaragoza, Málaga, and Bilbao."
9,"Various cultures developed alongside Phoenician, Greek, Celtic and Carthaginian migration and settlement."
11,"Spain remained under Roman rule until the collapse of the Western Roman Empire in the fourth century, which ushered in Germanic tribal confederations from Central Europe."
12,"The Visigoths emerged as the dominant faction by the fifth century, with their kingdom spanning much of the peninsula."
13,"In the early eighth century, the Visigothic Kingdom was conquered by the Umayyad Caliphate, ushering in over 700 years of Muslim rule."
14,"Islamic Spain became a major economic and intellectual center, with the city of Cordoba being among the largest and richest in Europe."
15,"Several Christian kingdoms emerged in the northern periphery of Iberia, chief among them León, Castile, Aragon, Portugal and Navarre."
16,"Over the next seven centuries, an intermittent southward expansion of these kingdoms—metahistorically framed as a reconquest, or Reconquista—culminated with the Christian seizure of the last Muslim polity, the Nasrid Kingdom of Granada, in 1492."
17,"That same year, Christopher Columbus arrived in the New World on behalf of the Catholic Monarchs, whose dynastic union of Castile and Aragon is sometimes considered the emergence Spain as a unified country."
19,Spain hosts the world's third-largest number of UNESCO World Heritage Sites.
20,"Spain is a secular parliamentary democracy and a parliamentary monarchy, with King Felipe VI as head of state."
21,"It is a highly developed country and a high income country, with the world's fourteenth-largest economy by nominal GDP and the sixteenth-largest by PPP."
27,"It may be a derivation of the Phoenician I-Shpania, meaning ""island of rabbits"", ""land of rabbits"" or ""edge"", a reference to Spain's location at the end of the Mediterranean; Roman coins struck in the region from the reign of Hadrian show a female figure with a rabbit at her feet, and Strabo called it the ""land of the rabbits""."
28,Both men wrote in two different published works that the first Jews to reach Spain were brought by ship by Phiros who was confederate with the king of Babylon when he laid siege to Jerusalem.
29,"Phiros was a Grecian by birth, but who had been given a kingdom in Spain."
30,"Phiros became related by marriage to Espan, the nephew of king Heracles, who also ruled over a kingdom in Spain."
31,"Heracles later renounced his throne in preference for his native Greece, leaving his kingdom to his nephew, Espan, from whom the country of España (Spain) took its name."
32,Early on its coastal areas were settled by Phoenicians who founded Western Europe's most ancient cities Cádiz and Málaga.
33,"Phoenician influence expanded as much of the Peninsula was eventually incorporated into the Carthaginian Empire, becoming a major theatre of the Punic Wars against the expanding Roman Empire."
34,"After an arduous conquest, the peninsula came fully under Roman rule."
35,"During the early Middle Ages it came under Visigothic rule, and then much of it was conquered by Muslim invaders from North Africa."
36,"In a process that took centuries, the small Christian kingdoms in the north gradually regained control of the peninsula."
38,"A global empire began which saw Spain become the strongest kingdom in Europe, the leading world power for one and a half  centuries, and the largest overseas empire for three centuries."
39,Continued wars and other problems eventually led to a diminished status.
40,"The Napoleonic conflict in Spain led to chaos, triggering independence movements that tore apart most of the empire and left the country politically unstable."
42,"Eventually, democracy was restored in the form of a parliamentary constitutional monarchy."
43,"Spain joined the European Union, experiencing a cultural renaissance and steady economic growth until the beginning of the 21st century, that started a new globalised world with economic and ecological challenges."
44,"In Atapuerca fossils have been found of the earliest known hominins in Europe, the Homo antecessor."
47,Archaeological and genetic evidence suggests that the Iberian Peninsula acted as one of several major refugia from which northern Europe was repopulated following the end of the last ice age.
48,The largest groups inhabiting the Iberian Peninsula before the Roman conquest were the Iberians and the Celts.
49,"The Iberians inhabited the Mediterranean side of the peninsula, from the northeast to the southeast."
50,"The Celts inhabited much of the inner and Atlantic sides of the peninsula, from the northwest to the southwest."
51,"Basques occupied the western area of the Pyrenees mountain range and adjacent areas, the Phoenician-influenced Tartessians culture flourished in the southwest and the Lusitanians and Vettones occupied areas in the central west."
52,"Several cities were founded along the coast by Phoenicians, and trading outposts and colonies were established by Greeks in the East."
53,"Eventually, Phoenician-Carthaginians expanded inland towards the meseta; however, due to the bellicose inland tribes, the Carthaginians got settled in the coasts of the Iberian Peninsula."
54,"Although it took the Romans nearly two centuries to complete the conquest of the Iberian Peninsula, they retained control of it for over six centuries."
55,"Hispania served as a granary for the Roman market, and its harbours exported gold, wool, olive oil, and wine."
56,"Agricultural production increased with the introduction of irrigation projects, some of which remain in use."
57,"Emperors Hadrian, Trajan, Theodosius I, and the philosopher Seneca were born in Hispania."
59,"Most of Spain's present languages and religion, and the basis of its laws, originate from this period."
62,The Suebi established a kingdom in what is today modern Galicia and northern Portugal whereas the Vandals established themselves in southern Spain by 420 before crossing over to North Africa in 429 and taking Carthage in 439.
63,"As the western empire disintegrated, the social and economic base became greatly simplified: but even in modified form, the successor regimes maintained many of the institutions and laws of the late empire, including Christianity and assimilation to the evolving Roman culture."
64,"The Byzantines established an occidental province, Spania, in the south, with the intention of reviving Roman rule throughout Iberia."
65,"Eventually, however, Hispania was reunited under Visigothic rule."
67,"Wallia extended his rule over most of the peninsula, keeping the Suebians shut up in Galicia."
68,"Theodoric I took part, with the Romans and Franks, in the Battle of the Catalaunian Plains, where Attila was routed."
69,"Euric (466), who put an end to the last remnants of Roman power in the peninsula, may be considered the first monarch of Spain, though the Suebians still maintained their independence in Galicia."
70,Euric was also the first king to give written laws to the Visigoths.
71,"In the following reigns the Catholic kings of France assumed the role of protectors of the Hispano-Roman Catholics against the Arianism of the Visigoths, and in the wars which ensued Alaric II and Amalaric lost their lives."
72,"Athanagild, having risen against King Agila, called in the Byzantines and, in payment for the succour they gave him, ceded to them the maritime places of the southeast (554)."
73,"Liuvigild restored the political unity of the peninsula, subduing the Suebians, but the religious divisions of the country, reaching even the royal family, brought on a civil war."
74,The religious unity established by this council was the basis of that fusion of Goths with Hispano-Romans which produced the Spanish nation.
75,The Spanish-Gothic scholars such as Braulio of Zaragoza and Isidore of Seville played an important role in keeping the classical Greek and Roman culture.
76,"Isidore was one of the most influential clerics and philosophers in the Middle Ages in Europe, and his theories were also vital to the conversion of the Visigothic Kingdom from an Arian domain to a Catholic one in the Councils of Toledo."
77,Isidore created the first western encyclopedia which had a huge impact during the Middle Ages.
78,These conquests were part of the expansion of the Umayyad Caliphate.
79,Only a small area in the mountainous north-west of the peninsula managed to resist the initial invasion.
80,"Legend has it that Count Julian, the governor of Ceuta, in revenge for the violation of his daughter, Florinda, by King Roderic, invited the Muslims and opened to them the gates of the peninsula."
81,"Under Islamic law, Christians and Jews were given the subordinate status of dhimmi."
82,"The Berber people of North Africa, who had provided the bulk of the invading armies, clashed with the Arab leadership from the Middle East."
83,"Over time, large Moorish populations became established, especially in the Guadalquivir River valley, the coastal plain of Valencia, the Ebro River valley and (towards the end of this period) in the mountainous region of Granada."
84,"Córdoba, the capital of the caliphate since Abd-ar-Rahman III, was the largest, richest and most sophisticated city in western Europe."
85,Mediterranean trade and cultural exchange flourished.
86,Muslims imported a rich intellectual tradition from the Middle East and North Africa.
87,"Some important philosophers at the time were Averroes, Ibn Arabi and Maimonides."
88,"The Romanised cultures of the Iberian Peninsula interacted with Muslim and Jewish cultures in complex ways, giving the region a distinctive culture."
89,"The arrival from North Africa of the Islamic ruling sects of the Almoravids and the Almohads restored unity upon the Muslim holdings, with a stricter, less tolerant application of Islam, and saw a revival in Muslim fortunes."
90,This re-united Islamic state experienced more than a century of successes that partially reversed Christian gains.
91,The Reconquista (Reconquest) was the centuries-long period in which Christian rule was re-established over the Iberian Peninsula.
92,The Reconquista is viewed as beginning with the Battle of Covadonga won by Don Pelayo in 722 and was concurrent with the period of Muslim rule on the Iberian Peninsula.
93,The Christian army's victory over Muslim forces led to the creation of the Christian Kingdom of Asturias along the northwestern coastal mountains.
100,"The Kingdom of Castile, formed from Leonese territory, was its successor as strongest kingdom."
101,The kings and the nobility fought for power and influence in this period.
102,"The example of the Roman emperors influenced the political objective of the Crown, while the nobles benefited from feudalism."
103,"Muslim armies had also moved north of the Pyrenees but they were defeated by Frankish forces at the Battle of Poitiers, Frankia and pushed out of the very southernmost region of France along the seacoast by the 760s."
104,"Later, Frankish forces established Christian counties on the southern side of the Pyrenees."
105,These areas were to grow into the kingdoms of Navarre and Aragon.
106,"For several centuries, the fluctuating frontier between the Muslim and Christian controlled areas of Iberia was along the Ebro and Douro valleys."
107,The Islamic transmission of the classics is the main Islamic contributions to Medieval Europe.
109,"Basque, the only non-Romance language in Spain, continued evolving from Early Basque to Medieval."
116,"From the mid 13th century, literature and philosophy started to flourish again in the Christian peninsular kingdoms, based on Roman and Gothic traditions."
117,An important philosopher from this time is Ramon Llull.
118,Abraham Cresques was a prominent Jewish cartographer.
119,Roman law and its institutions were the model for the legislators.
120,"The king Alfonso X of Castile focused on strengthening this Roman and Gothic past, and also on linking the Iberian Christian kingdoms with the rest of medieval European Christendom."
121,Alfonso worked for being elected emperor of the Holy Roman Empire and published the Siete Partidas code.
122,"The Toledo School of Translators is the name that commonly describes the group of scholars who worked together in the city of Toledo during the 12th and 13th centuries, to translate many of the philosophical and scientific works from Classical Arabic, Ancient Greek, and Ancient Hebrew."
123,"The 13th century also witnessed the Crown of Aragon, centred in Spain's north east, expand its reach across islands in the Mediterranean, to Sicily and Naples."
125,"Having conquered these, they turned their arms against the Byzantines, who treacherously slew their leaders; but for this treachery, the Spaniards, under Bernard of Rocafort and Berenguer of Entenca, exacted the terrible penalty celebrated in history as ""The Catalan Vengeance"" and seized the Frankish Duchy of Athens (1311)."
126,"The royal line of Aragon became extinct with Martin the Humane, and the Compromise of Caspe gave the Crown to the House of Trastámara, already reigning in Castile."
127,"As in the rest of Europe during the Late Middle Ages, Antisemitism greatly increased during the 14th century in the Christian kingdoms (a key event in that regard was the Black Death, as Jews were accused of poisoning the waters)."
129,"In 1391, Christian mobs went from town to town throughout Castile and Aragon, killing an estimated 50,000 Jews."
130,"Women and children were sold as slaves to Muslims, and many synagogues were converted into churches."
132,"1478 commenced the completion of the conquest of the Canary Islands and in 1492, the combined forces of Castile and Aragon captured the Emirate of Granada from its last ruler Muhammad XII, ending the last remnant of a 781-year presence of Islamic rule in Iberia."
133,"That same year, Spain's Jews were ordered to convert to Catholicism or face expulsion from Spanish territories during the Spanish Inquisition."
137,"A few decades after the Morisco rebellion of Granada known as the War of the Alpujarras, a significant proportion of Spain's formerly-Muslim population was expelled, settling primarily in North Africa."
138,"Columbus's first voyage crossed the Atlantic and reached the Caribbean Islands, beginning the European exploration and conquest of the Americas, although Columbus remained convinced that he had reached the Orient."
139,"Large numbers of indigenous Americans died in battle against the Spaniards during the conquest, while others died from various other causes."
140,Some scholars consider the initial period of the Spanish conquest— from Columbus's first landing in the Bahamas until the middle of the sixteenth century—as marking the most egregious case of genocide in the history of mankind.
142,The colonisation of the Americas started with conquistadores like Hernán Cortés and Francisco Pizarro.
143,Miscegenation was the rule between the native and the Spanish cultures and people.
144,"Juan Sebastian Elcano completed the first voyage around the world in human history, the Magellan-Elcano circumnavigation."
145,"Andrés de Urdaneta discovered the tornaviaje or return route from the Philippines to Mexico, making possible the Manila galleon trading route."
146,"The Spanish once again encountered Islam, but this time in Southeast Asia and in order to incorporate the Philippines, Spanish expeditions organised from newly Christianised Mexico had invaded the Philippine territories of the Sultanate of Brunei."
147,"The Spanish used the conflict between Pagan and Muslim Philippine kingdoms to pit them against each other thus using the ""Divide and Conquer Principle""."
148,"The Spanish considered the war with the Muslims of Brunei and the Philippines, a repeat of the Reconquista."
149,"With their wide-ranging political, legal, religious and military reforms, Spain emerged as the first world power."
150,"The death of their son Prince John caused the Crown to pass to Charles I (the Emperor Charles V), son of Juana la Loca."
151,"The unification of the crowns of Aragon and Castile by the marriage of their sovereigns laid the basis for modern Spain and the Spanish Empire, although each kingdom of Spain remained a separate country socially, politically, legally, and in currency and language."
152,There were two big revolts against the new Habsburg monarch and the more authoritarian and imperial-style crown: Revolt of the Comuneros in Castile and Revolt of the Brotherhoods in Majorca and Valencia.
153,"After years of combat, Comuneros Juan López de Padilla, Juan Bravo and Francisco Maldonado were executed and María Pacheco went into exile."
154,Germana de Foix also finished with the revolt in the Mediterranean.
157,"This period saw the Italian Wars, the Schmalkaldic War, the Dutch Revolt, the War of the Portuguese Succession, clashes with the Ottomans, intervention in the French Wars of Religion and the Anglo-Spanish War."
158,"Through exploration and conquest or royal marriage alliances and inheritance, the Spanish Empire expanded to include vast areas in the Americas, islands in the Asia-Pacific area, areas of Italy, cities in Northern Africa, as well as parts of what are now France, Germany, Belgium, Luxembourg, and the Netherlands."
160,It was the first empire on which it was said that the sun never set.
161,"This was an Age of Discovery, with daring explorations by sea and by land, the opening-up of new trade routes across oceans, conquests and the beginnings of European colonialism."
162,"Spanish explorers brought back precious metals, spices, luxuries, and previously unknown plants, and played a leading part in transforming the European understanding of the globe."
163,The cultural efflorescence witnessed during this period is now referred to as the Spanish Golden Age.
164,The expansion of the empire caused immense upheaval in the Americas as the collapse of societies and empires and new diseases from Europe devastated American indigenous populations.
165,"The rise of humanism, the Counter-Reformation and new geographical discoveries and conquests raised issues that were addressed by the intellectual movement now known as the School of Salamanca, which developed the first modern theories of what are now known as international law and human rights."
166,Juan Luis Vives was another prominent humanist during this period.
169,The Protestant Reformation dragged the kingdom ever more deeply into the mire of religiously charged wars.
170,The result was a country forced into ever-expanding military efforts across Europe and in the Mediterranean.
172,These conflicts drained it of resources and undermined the economy generally.
173,"Spain managed to hold on to most of the scattered Habsburg empire, and help the imperial forces of the Holy Roman Empire reverse a large part of the advances made by Protestant forces, but it was finally forced to recognise the separation of Portugal and the United Provinces, and eventually suffered some serious military reverses to France in the latter stages of the immensely destructive, Europe-wide Thirty Years' War."
174,"In the latter half of the 17th century, Spain went into a gradual decline, during which it surrendered several small territories to France and England; however, it maintained and enlarged its vast overseas empire, which remained intact until the beginning of the 19th century."
175,The decline culminated in a controversy over succession to the throne which consumed the first years of the 18th century.
176,"The War of the Spanish Succession was a wide-ranging international conflict combined with a civil war, and was to cost the kingdom its European possessions and its position as one of the leading powers on the Continent."
177,"During this war, a new dynasty originating in France, the Bourbons, was installed."
178,The new Bourbon monarchy drew on the French system of modernising the administration and the economy.
179,Enlightenment ideas began to gain ground among some of the kingdom's elite and monarchy.
180,Bourbon reformers created formal disciplined militias across the Atlantic.
181,"Spain needed every hand it could take during the seemingly endless wars of the eighteenth century—the Spanish War of Succession or Queen Anne's War (1702–13), the War of Jenkins' Ear (1739–42) which became the War of the Austrian Succession (1740–48), the Seven Years' War (1756–63) and the Anglo-Spanish War (1779–83)—and its new disciplined militias served around the Atlantic as needed."
185,Napoleon's troops entered the country to invade Portugal but instead occupied Spain's major fortresses.
186,"The Spanish king abdicated in favour of Napoleon's brother, Joseph Bonaparte."
187,Joseph Bonaparte was seen as a puppet monarch and was regarded with scorn by the Spanish.
189,These revolts marked the beginning of a devastating war of independence against the Napoleonic regime.
190,"It met as one body, and its members represented the entire Spanish empire."
192,These events foreshadowed the conflict between conservatives and liberals in the 19th and early 20th centuries.
193,Spain's conquest by France benefited Latin American anti-colonialists who resented the Imperial Spanish government's policies that favoured Spanish-born citizens (Peninsulars) over those born overseas (Criollos) and demanded retroversion of the sovereignty to the people.
195,"King Ferdinand VII's attempt to re-assert control proved futile as he faced opposition not only in the colonies but also in Spain and army revolts followed, led by liberal officers."
197,"The Napoleonic War left Spain economically ruined, deeply divided and politically unstable."
199,"Isabelline forces prevailed, but the conflict between progressives and moderates ended in a weak early constitutional period."
201,In the late 19th century nationalist movements arose in the Philippines and Cuba.
204,"El Desastre (the Disaster), as the war became known in Spain, gave added impetus to the Generation of '98 who were analyzing the country."
205,"Although the period around the turn of the century was one of increasing prosperity, the 20th century brought little social peace; Spain played a minor part in the scramble for Africa, with the colonisation of Western Sahara, Spanish Morocco and Equatorial Guinea."
207,The heavy losses suffered during the Rif War in Morocco brought discredit to the government and undermined the monarchy.
208,"Industrialisation, the development of railways and incipient capitalism developed in several areas of the country, particularly in Barcelona, as well as Labour movement and socialist and anarchist ideas."
212,"In the anarcho-sindicalist trend of the labour movement in Spain, Confederación Nacional del Trabajo was founded in 1910 and Federación Anarquista Ibérica in 1927."
213,"Catalanism and vasquism, alongside other nationalisms and regionalisms in Spain, arose in that period, being the Basque Nationalist Party formed in 1895 and Regionalist League of Catalonia in 1901."
214,Political corruption and repression weakened the democratic system of the constitutional monarchy of a two-parties system.
215,The Tragic Week events and repression examples the social instability of the time.
216,"These gave a resounding victory to the Republican-Socialist candidacies in large cities and provincial capitals, with a majority of monarchist councilors in rural areas."
220,"During the Second Republic there was a great political and social upheaval, marked by a sharp radicalization of the left and the right."
222,"On the other hand, it is also during the Second Republic when important reforms to modernize the country were initiated: a democratic constitution, agrarian reform, restructuring of the army, political decentralization and women's right to vote."
223,"The situation led to a civil war, in which the territory was divided into two zones: one under the authority of the Republican government, that counted on outside support from the Soviet Union and Mexico (and from International Brigades), and the other controlled by the putschists (the Nationalist or rebel faction), most critically supported by Nazi Germany and Fascist Italy."
224,The Republic was not supported by the Western powers due to the British-led policy of non-intervention.
226,An uneasy relationship between the Republican government and the grassroots anarchists who had initiated a partial Social revolution also ensued.
227,The civil war was viciously fought and there were many atrocities committed by all sides.
230,"The regime remained chiefly ""neutral"" from a nominal standpoint in the Second World War (it briefly switched its position to ""non-belligerent""), although it was sympathetic to the Axis and provided the Nazi Wehrmacht with Spanish volunteers in the Eastern Front."
232,"The name of ""Movimiento Nacional"", sometimes understood as a wider structure than the FET y de las JONS proper, largely imposed over the later's name in official documents along the 1950s."
233,"After World War II Spain was politically and economically isolated, and was kept out of the United Nations."
236,"Franco's rule was also characterised by authoritarianism, promotion of a unitary national identity, National Catholicism, and discriminatory language policies."
