,0
238,"The conventional explosives in two of the Mk28-type hydrogen bombs detonated upon impact with the ground, dispersing plutonium over nearby farms."
239,"With the approval of the new Spanish Constitution of 1978 and the restoration of democracy, the State devolved much authority to the regions and created an internal organisation based on autonomous communities."
240,"The Spanish 1977 Amnesty Law let people of Franco's regime continue inside institutions without consequences, even perpetrators of some crimes during transition to democracy like the Massacre of 3 March 1976 in Vitoria or 1977 Massacre of Atocha."
241,"In the Basque Country, moderate Basque nationalism coexisted with a radical nationalist movement led by the armed organisation ETA until the latter's dissolution in May 2018."
242,The group was formed in 1959 during Franco's rule but has continued to wage its violent campaign even after the restoration of democracy and the return of a large measure of regional autonomy.
244,"New cultural movements based on freedom appeared, like La Movida Madrileña and a culture of human rights arose with Gregorio Peces-Barba."
246,"That year the Spanish Socialist Workers Party (PSOE) came to power, the first left-wing government in 43 years."
251,"Though initial suspicions focused on the Basque terrorist group ETA, evidence soon emerged indicating Islamist involvement."
253,In 2005 the Spanish government legalised same sex marriage.
254,"Decentralisation was supported with much resistance of Constitutional Court and conservative opposition, so did gender politics like quotas or the law against gender violence."
255,"High levels of unemployment, cuts in government spending and corruption in Royal family and People's Party served as a backdrop to the 2011–12 Spanish protests."
256,Catalan independentism also rose.
257,"As prime minister, he continued to implement austerity measures required by the EU Stability and Growth Pact."
260,Later that day the Senate granted the power to impose direct rule and Mr Rajoy dissolved the Catalan parliament and called a new election.
263,Mount Teide (Tenerife) is the highest mountain peak in Spain and is the third largest volcano in the world from its base.
264,"Spain is a transcontinental country, having territory in both Europe and Africa."
266,"Along the Pyrenees in Girona, a small exclave town called Llívia is surrounded by France."
268,The peninsula of Vélez de la Gomera is also regarded as a plaza de soberanía.
269,"The isle of Alborán, located in the Mediterranean between Spain and North Africa, is also administered by Spain, specifically by the municipality of Almería, Andalusia."
270,The little Pheasant Island in the River Bidasoa is a Spanish-French condominium.
275,"Alluvial plains are found along the coast, the largest of which is that of the Guadalquivir in Andalusia."
277,The Csa zone is associated to areas with hot summers.
278,"It is predominant in the Mediterranean and Southern Atlantic coast and inland throughout Andalusia, Extremadura and much, if not most, of the centre of the country."
279,"The Csa zone covers climatic zones with both relatively warm and cold winters which are considered extremely different to each other at a local level, reason for which Köppen classification is often eschewed within Spain."
280,"Local climatic maps generally divide the Mediterranean zone (which covers most of the country) between warm-winter and cold-winter zones, rather than according to summer temperatures."
282,"Note areas with relatively high rainfall such as Galicia are not considered Mediterranean under local classifications, but classed as oceanic."
284,"It covers most of the Region of Murcia, southern Valencia and eastern Andalusia, where true hot desert climates also exist."
285,"Further to the north, it is predominant in the upper and mid reaches of the Ebro valley, which crosses southern Navarre, central Aragon and western Catalonia."
286,"It also is found in Madrid, Extremadura, Castilla-La Mancha, and some locations of western Andalusia."
287,The dry season extends beyond the summer and average temperature depends on altitude and latitude.
288,"The oceanic climate (Cfb), located in the northern quarter of the country, especially in the Atlantic region (Basque Country, Cantabria, Asturias, and partly Galicia and Castile–León)."
289,"Additionally it is also found in northern Navarre, in most highlands areas along the Iberian System and in the Pyrenean valleys, where a humid subtropical variant (Cfa) also occurs."
290,"The vegetation of Spain is varied due to several factors including the diversity of the terrain, the climate and latitude."
291,"Spain includes different phytogeographic regions, each with its own floral characteristics resulting largely from the interaction of climate, topography, soil type and fire, and biotic factors."
292,"In June 1976, Spain's new King Juan Carlos dismissed Carlos Arias Navarro and appointed the reformer Adolfo Suárez as Prime Minister."
296,The constitution also specifies that Spain has no state religion and that all are free to practice and believe as they wish.
297,The Spanish administration approved the Gender Equality Act in 2007 aimed at furthering equality between genders in Spanish political and economic life.
298,"The executive branch consists of a Council of Ministers presided over by the Prime Minister, who is nominated as candidate by the monarch after holding consultations with representatives from the different parliamentary groups, voted in by the members of the lower house during an investiture session and then formally appointed by the monarch."
300,"Deputy prime ministers (designated by the Prime Minister): Currently Carmen Calvo Poyato (1st), Pablo Iglesias Turrión (2nd), Nadia Calviño Santamaría (3rd), Teresa Ribera Rodríguez (4th)."
301,"Spain is organisationally structured as a so-called Estado de las Autonomías (""State of Autonomies""); it is one of the most decentralised countries in Europe, along with Switzerland, Germany and Belgium; for example, all autonomous communities have their own elected parliaments, governments, public administrations, budgets, and resources."
302,"Health and education systems among others are managed by the Spanish communities, and in addition, the Basque Country and Navarre also manage their own public finances based on foral provisions."
303,"In Catalonia, the Basque Country, Navarre and the Canary Islands, a full-fledged autonomous police corps replaces some of the State police functions (see Mossos d'Esquadra, Ertzaintza, Policía Foral/Foruzaingoa and Policía Canaria)."
305,Spain's EU membership represents an important part of its foreign policy.
311,"The overwhelming majority of Gibraltarians strongly oppose this, along with any proposal of shared sovereignty."
312,UN resolutions call on the United Kingdom and Spain to reach an agreement over the status of Gibraltar.
313,"The Spanish claim makes a distinction between the isthmus that connects the Rock to the Spanish mainland on the one hand, and the Rock and city of Gibraltar on the other."
314,"While the Rock and city were ceded by the Treaty of Utrecht, Spain asserts that the ""occupation of the isthmus is illegal and against the principles of International Law""."
315,"In clash with the Portuguese position, Spain claims that they are rocks rather than islands, and therefore Spain does not accept any extension of the Portuguese Exclusive Economic Zone (200 nautical miles) generated by the islands, while acknowledging the Selvagens having territorial waters (12 nautical miles)."
316,Its sovereignty is disputed between Spain and Morocco.
318,The incident ended when both countries agreed to return to the status quo ante which existed prior to the Moroccan occupation of the island.
319,The islet is now deserted and without any sign of sovereignty.
320,"Besides the Perejil Island, the Spanish-held territories claimed by other countries are two: Morocco claims the Spanish cities of Ceuta and Melilla and the plazas de soberanía islets off the northern coast of Africa."
321,Portugal does not recognise Spain's sovereignty over the territory of Olivenza which was annexed by Spain in 1801 after the War of the Oranges.
322,Portugal stance has been the territory being de iure Portuguese territory and de facto Spanish.
323,"Their Commander-in-chief is the King of Spain, Felipe VI."
324,The next military authorities in line are the Prime Minister and the Minister of Defence.
325,The fourth military authority of the State is the Chief of the Defence Staff (JEMAD).
333,"The concept of a comarca exists in all autonomous communities, however, unlike Catalonia, these are merely historical or geographical subdivisions."
335,"The autonomous communities were to comprise adjacent provinces with common historical, cultural, and economic traits."
336,"This territorial organisation, based on devolution, is known in Spain as the ""State of Autonomies""."
337,The basic institutional law of each autonomous community is the Statute of Autonomy.
338,"Andalusia also took that denomination in its first Statute of Autonomy, even though it followed the longer process stipulated in the constitution for the rest of the country."
339,"The distribution of powers may be different for every community, as laid out in their Statutes of Autonomy, since devolution was intended to be asymmetrical."
342,"In addition, the Basque Country, Catalonia and Navarre have police corps of their own: Ertzaintza, Mossos d'Esquadra and the Policía Foral respectively."
343,"Other communities have more limited forces or none at all, like the Policía Autónoma Andaluza in Andalusia or the BESCAM in Madrid."
344,"Nonetheless, recent amendments to existing Statutes of Autonomy or the promulgation of new Statutes altogether, have reduced the asymmetry between the powers originally granted to the nationalities and the rest of the regions."
346,These are two exclaves located in the northern African coast.
347,"In turn, provinces are divided into municipalities."
348,"The existence of both the provinces and the municipalities is guaranteed and protected by the constitution, not necessarily by the Statutes of Autonomy themselves."
349,"The communities of Asturias, Cantabria, La Rioja, the Balearic Islands, Madrid, Murcia and Navarre are the only communities that comprise a single province, which is coextensive with the community itself."
350,"In these cases, the administrative institutions of the province are replaced by the governmental institutions of the community."
351,The centre-right government of former prime minister José María Aznar worked successfully to gain admission to the group of countries launching the euro in 1999.
356,"Spain is the second biggest foreign investor there, after the United States."
357,"Spanish companies have also expanded into Asia, especially China and India."
358,This early global expansion is a competitive advantage over its competitors and European neighbours.
359,The reason for this early expansion is the booming interest towards Spanish language and culture in Asia and Africa and a corporate culture that learned to take risks in unstable markets.
362,"Areas relying on non-irrigated cultivation (secano), which made up 85% of the entire crop area, depended solely on rainfall as a source of water."
363,"They included the humid regions of the north and the northwest, as well as vast arid zones that had not been irrigated."
364,"The much more productive regions devoted to irrigated cultivation (regadío) accounted for 3 million hectares in 1986, and the government hoped that this area would eventually double, as it already had doubled since 1950."
365,Particularly noteworthy was the development in Almería—one of the most arid and desolate provinces of Spain—of winter crops of various fruits and vegetables for export to Europe.
367,"More than half of the irrigated area was planted in corn, fruit trees, and vegetables."
368,"Other agricultural products that benefited from irrigation included grapes, cotton, sugar beets, potatoes, legumes, olive trees, mangos, strawberries, tomatoes, and fodder grasses."
369,"Depending on the nature of the crop, it was possible to harvest two successive crops in the same year on about 10% of the country's irrigated land."
372,"Because of the changed diet of an increasingly affluent population, there was a notable increase in the consumption of livestock, poultry, and dairy products."
373,"Meat production for domestic consumption became the single most important agricultural activity, accounting for 30% of all farm-related production in 1983."
374,Increased attention to livestock was the reason that Spain became a net importer of grains.
375,"Ideal growing conditions, combined with proximity to important north European markets, made citrus fruits Spain's leading export."
376,"Fresh vegetables and fruits produced through intensive irrigation farming also became important export commodities, as did sunflower seed oil that was produced to compete with the more expensive olive oils in oversupply throughout the Mediterranean countries of the European Community."
377,The headquarters of the World Tourism Organization are located in Madrid.
378,"Spain's geographic location, popular coastlines, diverse landscapes, historical legacy, vibrant culture, and excellent infrastructure has made the country's international tourist industry among the largest in the world."
380,Spain is also Europe's main producer of wind energy.
386,"The former Minister of Industry Miguel Sebastián said that ""the electric vehicle is the future and the engine of an industrial revolution."
388,"On average, the Spanish high-speed train is the fastest one in the world, followed by the Japanese bullet train and the French TGV."
390,There are 47 public airports in Spain.
394,"Also, more than 30 airports with the number of passengers below 4 million."
395,"Despite the conditions, some important scientists and engineers emerged."
396,"The most notable were Miguel Servet, Santiago Ramón y Cajal, Narcís Monturiol, Celedonio Calatayud, Juan de la Cierva, Leonardo Torres y Quevedo, Margarita Salas and Severo Ochoa."
397,The Consejo Superior de Investigaciones Científicas (CSIC) is the leading public agency dedicated to scientific research in the country.
399,"With the exception of the region surrounding the capital, Madrid, the most populated areas lie around the coast."
402,A sizeable portion of foreign residents in Spain also comes from other Western and Central European countries.
403,"These are mostly British, French, German, Dutch, and Norwegian."
404,"They reside primarily on the Mediterranean coast and the Balearic islands, where many choose to live their retirement or telecommute."
405,"Substantial populations descended from Spanish colonists and immigrants exist in other parts of the world, most notably in Latin America."
412,Spain has been described as a de facto plurinational state.
413,The identity of Spain rather accrues of an overlap of different territorial and ethnolinguistic identities than of a sole Spanish identity.
414,In some cases some of the territorial identities may conflict with the dominant Spanish culture.
415,"Distinct traditional identities within Spain include the Basques, Catalans, Galicians, Andalusians and Valencians, although to some extent all of the 17 autonomous communities may claim a distinct local identity."
416,"It is this last feature of ""shared identity"" between the more local level or autonomous community and the Spanish level which makes the identity question in Spain complex and far from univocal."
417,Smaller numbers of immigrants from several Sub-Saharan countries have recently been settling in Spain.
418,"There are also sizeable numbers of Asian immigrants, most of whom are of Middle Eastern, South Asian and Chinese origin."
420,Their origin is unclear.
421,"Historically, Sephardi Jews and Moriscos are the main minority groups originated in Spain and with a contribution to Spanish culture."
422,The Spanish government is offering Spanish nationality to Sephardi Jews.
427,"There are a number of reasons for the high level of immigration, including Spain's cultural ties with Latin America, its geographical position, the porosity of its borders, the large size of its underground economy and the strength of the agricultural and construction sectors, which demand more low cost labour than can be offered by the national workforce."
428,Another statistically significant factor is the large number of residents of EU origin typically retiring to Spain's Mediterranean coast.
429,"The programme had little effect; during its first two months, just 1,400 immigrants took up the offer."
430,"What the programme failed to do, the sharp and prolonged economic crisis has done from 2010 to 2011 in that tens of thousands of immigrants have left the country due to lack of jobs."
432,"For the first time in decades the net migration rate was expected to be negative, and nine out of 10 emigrants were foreigners."
434,"In the North African Spanish autonomous city of Melilla, Riff Berber is spoken by a significant part of the population."
435,"Similarly, in Ceuta Darija Arabic is spoken by a significant percentage of the population."
436,"In the tourist areas of the Mediterranean coast and the islands, English and German are widely spoken by tourists, foreign residents, and tourism workers."
439,"In regards to the professional development education or the vocational education, there are three levels besides the university degrees: the Formación Profesional Básica (basic vocational education); the Ciclo Formativo de Grado Medio or CFGM (medium level vocation education) which can be studied after studying the secondary education, and the Ciclo Formativo de Grado Superior or CFGS (higher level vocational education), which can be studied after studying the post-16 education level."
440,"The health care is public, universal and free for any legal citizen of Spain."
441,"Although it no longer has official status by law, in all public schools in Spain students have to choose either a religion or ethics class."
442,"Catholicism is the religion most commonly taught, although the teaching of Islam, Judaism, and evangelical Christianity is also recognised in law."
444,Most Spaniards do not participate regularly in religious services.
446,There have been four Spanish Popes.
448,"Spanish mysticism provided an important intellectual resource against Protestantism with Carmelites like Teresa of Ávila, a reformist nun and John of the Cross, a priest, taking the lead in their reform movement."
449,"Later, they became Doctors of the Church."
450,"The Society of Jesus was co-founded by Ignatius of Loyola, whose Spiritual Exercises and movement led to the establishment of hundreds of colleges and universities in the world, including 28 in the United States alone."
451,"The Society's co-founder, Francis Xavier, was a missionary who reached India and later Japan."
457,Late 19th-century colonial expansion in northwestern Africa gave a number of residents in Spanish Morocco and Western Sahara full citizenship.
458,"Most are arrivals in the past century, while some are descendants of earlier Spanish Jews."
463,"Almost every aspect of Spanish life is permeated by its Roman heritage, making Spain one of the major Latin countries of Europe."
464,"Spanish culture is marked by strong historic ties to Catholicism, which played a pivotal role in the country's formation and subsequent identity."
465,"Spanish art, architecture, cuisine, and music have been shaped by successive waves of foreign invaders, as well as by the country's Mediterranean climate and geography."
466,"The centuries-long colonial era globalised Spanish language and culture, with Spain also absorbing the cultural and commercial products of its diverse empire."
467,"These include the landscape of Monte Perdido in the Pyrenees, which is shared with France, the Prehistoric Rock Art Sites of the Côa Valley and Siega Verde, which is shared with Portugal, the Heritage of Mercury, shared with Slovenia and the Ancient and Primeval Beech Forests, shared with other countries of Europe."
469,The Valencian chivalric romance Tirant lo Blanch written in Valencian is also remarkable.
470,"Other major plays from the medieval times were Mester de Juglaría, Mester de Clerecía, Coplas por la muerte de su padre or El Libro de buen amor (The Book of Good Love)."
472,The Baroque is the most important period for Spanish culture.
473,We are in the times of the Spanish Empire.
474,The famous Don Quijote de La Mancha by Miguel de Cervantes was written in this time.
480,Realism offered depictions of contemporary life and society 'as they were'.
481,"In the spirit of general ""Realism"", Realist authors opted for depictions of everyday and banal activities and experiences, instead of romanticised or stylised presentations."
482,"The group that has become known as the Generation of 1898 was marked by the destruction of Spain's fleet in Cuba by US gunboats in 1898, which provoked a cultural crisis in Spain."
485,"These writers, along with Ramón del Valle-Inclán, Antonio Machado, Ramiro de Maeztu, and Ángel Ganivet, came to be known as the Generation of '98."
487,"The next supposed ""generation"" of Spanish writers following those of '98 already calls into question the value of such terminology."
490,"While still driven by the national and existential questions that obsessed the writers of '98, they approached these topics with a greater sense of distance and objectivity."
491,"Salvador de Madariaga, another prominent intellectual and writer, was one of the founders of the College of Europe and the composer of the constitutive manifest of the Liberal International."
493,"All were scholars of their national literary heritage, again evidence of the impact of the calls of regeneracionistas and the Generation of 1898 for Spanish intelligence to turn at least partially inwards."
495,"Spain is one of the countries with the most laureates of the Nobel Prize in Literature, and including Latin American Nobel laureates, Spanish language literature ranks among the highest in numbers of laureates."
498,Saramago was also well known by his Iberist ideas.
501,Premio Planeta de Novela and Miguel de Cervantes Prize are the two main awards nowadays in Spanish literature.
502,"Due to historical, geographical and generational diversity, Spanish art has known a great number of influences."
503,"The Mediterranean heritage with Greco-Roman and some Moorish and influences in Spain, especially in Andalusia, is still evident today."
504,"European influences include Italy, Germany and France, especially during the Renaissance, Spanish Baroque and Neoclassical periods."
506,"His main works were the upper stalls of the choir of the Cathedral of Toledo, the tomb of Cardinal Tavera in the same Cathedral, and the altarpiece of the Visitation in the church of Santa Úrsula in the same locality."
507,"In the 20th century the most important Spanish sculptors were Julio González, Pablo Gargallo, Eduardo Chillida, and Pablo Serrano."
508,"In the long history of Spanish cinema, the great filmmaker Luis Buñuel was the first to achieve world recognition, followed by Pedro Almodóvar in the 1980s (La Movida Madrileña)."
509,International Film Festivals of Valladolid and San Sebastian are the oldest and more relevant in Spain.
510,"An important provincial city founded by the Romans and with an extensive Roman era infrastructure, Córdoba became the cultural capital, including fine Arabic style architecture, during the time of the Islamic Umayyad dynasty."
511,There was then an extraordinary flowering of the Gothic style that resulted in numerous instances being built throughout the entire territory.
512,"An influential style centred in Barcelona, known as modernisme, produced a number of important architects, of which Gaudí is one."
513,The International style was led by groups like GATEPAC.
514,"Spain is currently experiencing a revolution in contemporary architecture and Spanish architects like Rafael Moneo, Santiago Calatrava, Ricardo Bofill as well as many others have gained worldwide renown."
515,"Various regional styles of folk music abound in Aragon, Catalonia, Valencia, Castile, the Basque Country, Galicia, Cantabria and Asturias."
516,"Pop, rock, hip hop and heavy metal are also popular."
517,"In the field of classical music, Spain has produced a number of noted composers such as Isaac Albéniz, Manuel de Falla and Enrique Granados and singers and performers such as Plácido Domingo, José Carreras, Montserrat Caballé, Alicia de Larrocha, Alfredo Kraus, Pablo Casals, Ricardo Viñes, José Iturbi, Pablo de Sarasate, Jordi Savall and Teresa Berganza."
518,"In Spain there are over forty professional orchestras, including the Orquestra Simfònica de Barcelona, Orquesta Nacional de España and the Orquesta Sinfónica de Madrid."
519,"Major opera houses include the Teatro Real, the Gran Teatre del Liceu, Teatro Arriaga and the El Palau de les Arts Reina Sofía."
520,"Thousands of music fans also travel to Spain each year for internationally recognised summer music festivals Sónar which often features the top up and coming pop and techno acts, and Benicàssim which tends to feature alternative rock and dance acts."
521,"The most popular traditional musical instrument, the guitar, originated in Spain."
522,"Typical of the north are the traditional bag pipers or gaiteros, mainly in Asturias and Galicia."
523,"It is heavily influenced by seafood available from the waters that surround the country, and reflects the country's deep Mediterranean roots."
524,Spain's extensive history with many cultural influences has led to a unique cuisine.
